user_id,dataset,timestamp,speaker,line,direction,agree_cnt,reason,possible_comment,created_at
860,ES2004b,2088.17,D,"that sounds a really attractive idea, I've not come across anything like that before, if it kind of yeah and that opens out into your flip-top.",POSITIVE,9,Being positive,This comment is praising towards the idea that was presented well.,2021-03-30 02:03:37.877233+00:00
860,ES2004b,2339.29,B,Um and I'll be able to not answer them.,POSITIVE,3,Being positive,This seems to be a comment made in jest which may lighten up the mood.,2021-03-30 02:05:39.685369+00:00
865,ES2004b,325.58,C,"Um no no, if you if you look at if you look at most remote controls they're quite they're quite chunky and that's because of the size of the batteries, they have to be obviously this certain size to fit those batteries in.",NEGATIVE,2,Dismissing others,It looks as if you cut the previous speaker off before they could finish their question.,2021-03-30 07:55:27.452970+00:00
866,ES2004b,517.15,D,"That's a very important part, it came up in our market research findings too so I can refer to that, whenever you like me to present.",POSITIVE,5,Being positive,"In the line, D expresses that C's findings were important; I can imagine that this made C feel like their work was valuable, which would be encouraging.",2021-03-30 08:40:41.645697+00:00
866,ES2004b,321.73,C,Yeah sure.,POSITIVE,3,Being Open to Feedback,"On a slightly smaller level of reinforcement, when D asked if it would be ""appropriate"" to interject with a question, C gave an affirmative answer that went beyond just a muttering or simple utterance (like B, who said ""Mm-hmm""). This would make D feel welcome to ask questions and give feedback in the future.",2021-03-30 08:42:51.795521+00:00
866,ES2004b,809.59,B,We just do the best we can.,POSITIVE,5,Being positive,"If I'm reading the context of this line correctly (and in the event that this is not sarcasm), B is being encouraging and remaining positive while there appears to be some sort of technical difficulty.",2021-03-30 08:45:02.194715+00:00
765,ES2004b,422.76,C,"It's not a proper circuit, I'm not sure if it'd work or not, I'm not even confident that those are the real um the real way you'd wire it up but anyway, we've just got the the power going to the infrared bulb with the chip and the",NEGATIVE,1,Causing embarrassment,It wasn't put together properly. that is embarrasingto point out,2021-03-30 10:09:02.496548+00:00
765,ES2004b,510.91,C,<sound: laugh>,NEGATIVE,1,Causing embarrassment,laughing at a suggestion would be embarrassing and harmful to the person being laughed at,2021-03-30 10:10:01.722844+00:00
765,ES2004b,616.2,A,"Actually mm some of my points might overlap with what William's just mention, but basically my method was like uh whatever brainstorming we did in the last meeting, just a couple of valuable points and started developing on that and there might be some missing loops in this thing which I think we'll uh take a feedback from the marketing because",POSITIVE,1,Being agreeable,Saying that some points overlap with Williams reinforce that William had good points that more than one person had thought of.,2021-03-30 10:11:05.047686+00:00
765,ES2004b,792.6,B,"Oh, God.",NEGATIVE,1,Being sarcastic,Oh God is more sarcastic. It is something that would be said with an eye roll in this context which is harmful and disrespectful,2021-03-30 10:12:43.237623+00:00
765,ES2004b,1188.44,B,"Yeah, bu",NEGATIVE,1,argumentative,"""yeah but"" is argumentative. It will harm the person originally talking knowing that someone is ready to disagree with them",2021-03-30 10:15:48.214756+00:00
765,ES2004b,1406.93,C,they're c uh just generally Japanese people have smaller hands so they couldn't get round the controller which is uh so if you I don't know what 'cause you obviously you can have bigger buttons for some countries or something and smaller ones for others.,NEGATIVE,9,Punishing others,Basically calling out a specific country for having people with smaller hands is discriminatory.,2021-03-30 10:17:25.148631+00:00
765,ES2004b,2339.29,B,Um and I'll be able to not answer them.,NEGATIVE,5,Dismissing others,Specifically saying that if you email questions they won't be answered? Completely dismissive!,2021-03-30 10:22:03.544375+00:00
869,ES2004b,321.73,C,Yeah sure.,POSITIVE,3,Being respectful,"C shows respect for others to ask a question in the middle of C's speech, welcoming others feedback",2021-03-31 05:01:13.421682+00:00
869,ES2004b,517.15,D,"That's a very important part, it came up in our market research findings too so I can refer to that, whenever you like me to present.",POSITIVE,5,Being positive,"D provides a positive comment on C's speech, making C feel good",2021-03-31 05:03:05.228282+00:00
869,ES2004b,530.18,B,"Um, would you like to continue on from that?",POSITIVE,2,Being respectful,"B is asking for C's further comments, which might lead C to contribute more to the discussion",2021-03-31 05:04:02.370657+00:00
869,ES2004b,535.92,B,"Or, maybe move the laptop over.",NEGATIVE,4,Causing embarrassment,B's words are weird and might prevent C from giving more feedback,2021-03-31 05:05:10.430337+00:00
869,ES2004b,536.24,A,"It can be okay, that's okay with me.",POSITIVE,1,Being positive,A provides a positive feedback to make C less embarassed.,2021-03-31 05:05:43.559225+00:00
870,ES2004b,319.7,D,"Could I can I interject to ask a question there, is that appropriate?",POSITIVE,8,Being respectful,"instead of interrupting, D asked if a question can be asked.",2021-03-31 06:00:25.514814+00:00
870,ES2004b,321.73,C,Yeah sure.,POSITIVE,3,Being agreeable,C agrees that an interjection should be posed by recognizing D,2021-03-31 06:01:47.712344+00:00
870,ES2004b,527.67,B,"Okay, thank you very much.",POSITIVE,5,Being respectful,B thanks C for the input he has given about the batteries,2021-03-31 06:04:24.309575+00:00
870,ES2004b,594.77,B,F_ function.,POSITIVE,1,Being instructive,B confirms A's question about which function key to use for the laptop.,2021-03-31 06:05:38.520552+00:00
870,ES2004b,736.03,C,Yeah.,POSITIVE,1,Being agreeable,C is confirming A's point about the increased production level by 50 million,2021-03-31 06:07:20.966681+00:00
889,ES2004b,788.55,B,"Ooh, it's vibrating, that's strange.",NEGATIVE,2,Dismissing others,"This line was dismissive in nature because the group had decided to save comments until the end of the discussion, and this comment was voiced immediately.",2021-03-31 10:57:57.156318+00:00
889,ES2004b,805.69,D,Does it matter?,NEGATIVE,1,Being sarcastic,The tone of this comment comes off as sarcastic and therefore unhelpful to the group.,2021-03-31 10:59:17.796535+00:00
889,ES2004b,807.27,A,It'll have to this can't be pulled.,NEGATIVE,1,Dismissing others,"This comment is dismissive of the comments regarding issues with this product, because they say that no changes can be made // the product can't be pulled.",2021-03-31 11:00:47.322063+00:00
889,ES2004b,809.59,B,We just do the best we can.,POSITIVE,5,Being positive,This comment positively affects the group by reaffirming that they can only do their best in the situation.,2021-03-31 11:03:09.065862+00:00
889,ES2004b,828.31,C,<sound: laugh>.,POSITIVE,1,Being agreeable,Laughing along with the group further establishes a team mentality and further unites the team members into a team.,2021-03-31 11:04:40.962534+00:00
889,ES2004b,845.63,D,"Okay, um, I'm going to look at the functional requirements from the marketing point of view and uh obviously our starting point with marketing is always market research.",NEGATIVE,1,Being sarcastic,"By pointing out the starting point as being ""obvious,"" they may have harmed some team members who did not know that and did not find it obvious.",2021-03-31 11:08:48.097077+00:00
889,ES2004b,922.62,A,Yeah.,POSITIVE,2,Being agreeable,"This member is agreeing with the statement made by the last team member, D.",2021-03-31 11:09:58.113659+00:00
889,ES2004b,1027.78,A,'Kay.,POSITIVE,1,Being agreeable,"Confirming that they understand and agree with the previous comment made by ""D.""",2021-03-31 11:12:10.317318+00:00
889,ES2004b,1094.25,B,"I don't know, what do you think?",POSITIVE,7,Being respectful,This member asks for other group member's opinions and thoughts.,2021-03-31 11:13:04.616642+00:00
889,ES2004b,1154.53,D,So I don't know if that's something we need to look at.,NEGATIVE,2,Being sarcastic,"This team member's comment, preceded by a laugh, lays a sarcastic tone that may prove harmful to the group.",2021-03-31 11:14:19.691414+00:00
242,ES2004b,809.59,B,We just do the best we can.,POSITIVE,5,Being positive,The speaker is telling the group that doing their best is good enough.,2021-03-31 11:40:10.725565+00:00
242,ES2004b,845.63,D,"Okay, um, I'm going to look at the functional requirements from the marketing point of view and uh obviously our starting point with marketing is always market research.",POSITIVE,1,Being respectful,The speaker is getting the group back on task and helping them to focus in a respectful manner.,2021-03-31 11:42:15.393936+00:00
242,ES2004b,1094.25,B,"I don't know, what do you think?",POSITIVE,7,Being respectful,The speaker is being respectful by asking the rest of the group their opinions on what they should do.,2021-03-31 11:44:28.891805+00:00
242,ES2004b,1467.96,B,"It's gonna be the same, so we need to focus on just one thing, not get bogged down in lots of different um possibilities, um.",POSITIVE,5,Being positive,The speaker is getting the group to focus instead of moving in multiple directions at once.,2021-03-31 11:49:16.703912+00:00
242,ES2004b,1723.2,D,"Can I just run this past you while it occurs to me, I don't mean to quickly jump from one subject to another, but just discussing the different age groups and targeting the different age groups it occurs to me,",POSITIVE,3,Being respectful,The speaker apologized to the other speaker for pushing the conversation in a different direction.,2021-03-31 11:52:07.356541+00:00
45,ES2004b,1233.66,D,That's a super idea.,POSITIVE,19,Being positive,Thank you for your positive reinforcement of a teammate's idea!,2021-03-31 12:00:09.316118+00:00
9,ES2004b,1094.25,B,"I don't know, what do you think?",NEGATIVE,1,Being passive-aggressive,sounds a little upset with this comment. May be frustrated.,2021-03-31 12:01:34.198203+00:00
9,ES2004b,1104.44,B,I mean you bu well som you get com you get combined T_V_ and videos don't you?,NEGATIVE,1,Being sarcastic,sounds upset at this point that their idea is not being agreed upon.,2021-03-31 12:02:09.131122+00:00
45,ES2004b,1402.84,B,Were too big.,NEGATIVE,5,Causing annoyance,Please let your teammates finish their thoughts before speaking/finishing their thoughts for them. Thank you!,2021-03-31 12:03:06.037414+00:00
9,ES2004b,1233.66,D,That's a super idea.,POSITIVE,19,Being agreeable,Telling other teammate that the idea was great. Very positive comment.,2021-03-31 12:04:17.577162+00:00
45,ES2004b,1537.5,A,We could focus on the biggest market.,POSITIVE,3,Being agreeable,Good positive reinforcement of your teammate's idea! Thank you for showing support to your peers.,2021-03-31 12:04:54.701330+00:00
9,ES2004b,1406.93,C,they're c uh just generally Japanese people have smaller hands so they couldn't get round the controller which is uh so if you I don't know what 'cause you obviously you can have bigger buttons for some countries or something and smaller ones for others.,NEGATIVE,9,Dismissing others,to say that most japanese people have smaller hands may be a bit of a stretch.,2021-03-31 12:05:26.775806+00:00
9,ES2004b,1467.96,B,"It's gonna be the same, so we need to focus on just one thing, not get bogged down in lots of different um possibilities, um.",NEGATIVE,11,Dismissing others,disagreeing with the group and saying that there are too many ideas. Saying that they should focus on one idea and devote total attention to it.,2021-03-31 12:06:15.464634+00:00
45,ES2004b,1818.27,B,Instruction manuals.,NEGATIVE,2,Causing embarrassment,Please don't correct the phrasing of your peers if it is obvious what they are referring to. Thank you.,2021-03-31 12:08:34.943729+00:00
45,ES2004b,1933.38,C,"Yeah yeah th yeah that that'd be fine, and also that would mean they wouldn't have to go out buying batteries all the time.",POSITIVE,5,Being agreeable,Thank you for your positive reinforcement of your teammates ideas!,2021-03-31 12:09:31.566787+00:00
556,ES2004b,788.55,B,"Ooh, it's vibrating, that's strange.",POSITIVE,1,Being positive,"The speaker is speaking in a playful manner, lightening the mood of the meeting",2021-03-31 14:20:21.324274+00:00
556,ES2004b,813.0,A,You'll have to push it a bit more.,POSITIVE,1,Being agreeable,The speaker is helping his teammate figure out an issue they are having with some tech,2021-03-31 14:20:54.855308+00:00
556,ES2004b,841.71,D,"Get it right over, okay, thank you.",POSITIVE,3,Being positive,The speaker is thanking the team for helping them out with their issues,2021-03-31 14:21:31.385684+00:00
556,ES2004b,1027.47,D,"I had marvellous tables and things that I could show you, but I think I'll just keep it simple, if there's any more information I can email you extra details, is that okay?",POSITIVE,1,Being positive,"The speaker is using colorful language to make it more fun, and is respecting the time of the group",2021-03-31 14:22:06.251658+00:00
556,ES2004b,1109.05,C,"If yeah and if you got if you got a Sky box, they have one of those plus boxes, you can record straight off the T_V_ anyway so on to on to like the T_V_ hard drive or so.",POSITIVE,1,Being respectful,The speaker is actively engaged and responding to what their team is talking about,2021-03-31 14:22:37.986778+00:00
772,ES2004b,803.09,D,Have I got to keep this here?,POSITIVE,1,Being respectful,Asking about what you should be doing shows you respect the structure of the meeting and the other participants.,2021-03-31 16:00:47.295482+00:00
772,ES2004b,809.59,B,We just do the best we can.,POSITIVE,5,Being positive,You are letting the others know that you appreciate they are doing the best they can.,2021-03-31 16:01:26.489337+00:00
772,ES2004b,836.79,D,"Thank you, just pull it closer a little bit.",POSITIVE,1,Being respectful,Saying thank you shows that you appreciate and have respect for others.,2021-03-31 16:02:13.173963+00:00
772,ES2004b,857.25,D,"Um, so that's where we started, we used our our usability lab, the company's usability lab, we did our usual selection methods to get a cross-section of the general public, male and female, all age groups from fifteen upwards and um we observed them in the lab, just their general use of the remote control, you can see we had a hundred subjects there.",POSITIVE,1,being inclusive,Repeating we here makes the group seem like a team and reminds people they are important.,2021-03-31 16:03:02.539090+00:00
772,ES2004b,922.62,A,Yeah.,POSITIVE,2,being attentive,You are showing that you are paying attention which lets the presenter know you appreciate what they are saying.,2021-03-31 16:04:04.454817+00:00
654,ES2004b,788.55,B,"Ooh, it's vibrating, that's strange.",NEGATIVE,2,Causing embarrassment,Saying something is strange if it's something another group member did makes that member feel bad about what they've done which is unconducive to a positive work environment.,2021-03-31 16:57:14.958372+00:00
654,ES2004b,809.59,B,We just do the best we can.,POSITIVE,5,Being positive,"This is encouraging for the group, motivating them to continue.",2021-03-31 16:58:02.334339+00:00
654,ES2004b,841.71,D,"Get it right over, okay, thank you.",POSITIVE,3,Being respectful,Thanking someone for helping them is a considerate thing to do and makes the helper feel validated.,2021-03-31 16:59:01.520150+00:00
654,ES2004b,877.29,D,"Our findings, lots of findings, I've just summarised some of them here.",POSITIVE,1,Being helpful,Summarizing points into a more digestible manner is helpful for the other group participants for their understanding.;,2021-03-31 17:00:01.119798+00:00
654,ES2004b,934.54,D,Um and possibly we can also cut back on cost if we don't have so many functions actually on the remote control.,POSITIVE,1,Being helpful,Offering ways to improve upon design for what they're working on is constructive and helpful.,2021-03-31 17:01:33.206768+00:00
933,ES2004b,782.79,D,'Kay.,NEGATIVE,1,Being passive-aggressive,This is passive-aggressive behavior that will only serve to leave uncertainty in the mind of speaker instead of moving the conversation along.,2021-03-31 17:20:27.439368+00:00
933,ES2004b,809.59,B,We just do the best we can.,NEGATIVE,1,Being too timid,"Saying this is the same as ""it is what it is."" It's a losing statement. It will diminish group morale.",2021-03-31 17:21:47.919964+00:00
933,ES2004b,896.95,D,"Eighty percent would spend more money when a remote control would look fancy, we were quite surprised by that finding, but um that's quite a high proportion of our our, you know, international target group are prepared to spend more money for something that's a bit nicer looking.",POSITIVE,1,Being constructively honest,Being upfront about negative feedback in a respectful manner will keep the group on point and generate alternative solutions.,2021-03-31 17:24:12.866104+00:00
933,ES2004b,1027.78,A,'Kay.,NEGATIVE,2,Being passive-aggressive,This is too vague a response considering the severity of the topic regarding the product.,2021-03-31 17:25:10.860464+00:00
933,ES2004b,1031.881,C,<sound: laugh>,NEGATIVE,2,Causing annoyance,Laughing at customer feedback and statistics is counterintuitive to productivity.,2021-03-31 17:26:09.454205+00:00
113,ES2004b,1036.15,A,That's fine.,POSITIVE,1,Being agreeable,"This statement gives affirmation and is agreeable in a more definitive way than just saying ""yeah"".",2021-03-31 18:54:03.575920+00:00
113,ES2004b,1108.66,D,"Mm-hmm, yes.",POSITIVE,2,Being agreeable,"This statement uses two affirmative statements in a row. This makes a very clear overall statement of agreement, and yes is much clearer than ""yeah"".",2021-03-31 18:55:09.598724+00:00
113,ES2004b,1233.66,D,That's a super idea.,POSITIVE,19,Being positive,This is a complementary statement that uses strong positive language (super). This builds confidence and morale.,2021-03-31 18:56:07.302308+00:00
113,ES2004b,1510.52,D,"I know, and it becomes ridiculous, yes I know.",POSITIVE,1,Being agreeable,"This statement empathizes with the previous speaker and affirms, which promotes unity and understanding.",2021-03-31 18:58:00.801530+00:00
113,ES2004b,1665.69,D,"Right, I've not come across that function but it sounds wonderful",POSITIVE,6,Being agreeable,"This statement is affirming and complementary, using strong positive language (wonderful).",2021-03-31 18:59:07.893458+00:00
9,ES2004b,1233.66,D,That's a super idea.,POSITIVE,19,Being agreeable,giving other team member feedback on their idea and saying that they like it.,2021-04-01 10:49:39.721956+00:00
9,ES2004b,1355.18,B,"You don't have to press it, you just have to put your thumb onto it.",POSITIVE,4,Being agreeable,Helped finish other teammates line. This shows that they are engaged and also agree with idea.,2021-04-01 10:50:52.910643+00:00
9,ES2004b,1406.93,C,they're c uh just generally Japanese people have smaller hands so they couldn't get round the controller which is uh so if you I don't know what 'cause you obviously you can have bigger buttons for some countries or something and smaller ones for others.,NEGATIVE,9,Dismissing others,"Being a little stereotypical of asians with this comment. Not sure if asians statistically have smaller hands, or if this is just a ill advised comment.",2021-04-01 10:51:33.140888+00:00
9,ES2004b,1467.96,B,"It's gonna be the same, so we need to focus on just one thing, not get bogged down in lots of different um possibilities, um.",POSITIVE,5,leading well,"Does a nice job keeping the group on track and doesnt waste their time thinking of multiple ideas, instead of agreeing to focus on one big one.",2021-04-01 10:52:39.587245+00:00
9,ES2004b,1496.07,D,"I'm j I really can't get my head round this one, this may have to be postponed to a future meeting but it's something we should think about.",POSITIVE,6,Being respectful,Being realistic. Wants to push decision back so they dont have to rush and can come to a consensus opinion.,2021-04-01 10:53:17.484923+00:00
785,ES2004b,1167.64,C,"Alright, okay.",POSITIVE,3,Being agreeable,agreeing with the data shared by other participant helps with collaboration.,2021-04-01 11:04:06.370900+00:00
785,ES2004b,1232.06,D,Yes.,POSITIVE,1,Being agreeable,agreeing with a viable and good idea builds trust and better collaboration.,2021-04-01 11:06:19.794010+00:00
785,ES2004b,1233.66,D,That's a super idea.,POSITIVE,19,Being positive,"Instead of just agreeing, making a comment like this tells the others that you really like the idea and give positive vibes.",2021-04-01 11:07:04.338275+00:00
785,ES2004b,1259.31,B,"Um, people paying more for it to look good.",NEGATIVE,1,Being sarcastic,The person does not believe in the argument and making a sarcastic comment.,2021-04-01 11:07:56.752934+00:00
785,ES2004b,1631.98,C,Yeah yeah.,POSITIVE,1,Being agreeable,providing support for other ideas builds trust and collaboration between the team.,2021-04-01 11:17:50.122841+00:00
971,ES2004b,1094.25,B,"I don't know, what do you think?",POSITIVE,7,Being respectful,showing a lack of knowledge and asking for help,2021-04-01 11:49:22.086017+00:00
971,ES2004b,1099.29,C,T yeah yeah.,POSITIVE,1,Being agreeable,This was a good example of voicing agreement. very informal and comfortable,2021-04-01 11:50:31.468910+00:00
971,ES2004b,1154.53,D,So I don't know if that's something we need to look at.,POSITIVE,1,Being respectful,Although this is a statement that disagrees it is not aggressive,2021-04-01 11:54:23.670228+00:00
971,ES2004b,1167.64,C,"Alright, okay.",POSITIVE,3,Being positive,this statement acknowledges the statement and agrees with the other speaker,2021-04-01 11:56:03.485608+00:00
971,ES2004b,1188.63,C,Yeah but um on on that again I just thought 'cause you can get those key chains now and you whistle and then it'll let off a loud noise to let you know where it is so I thought that could be quite a,NEGATIVE,2,interrupted the other speaker,the content doesn't show much harm but the timestamp shows that C interrupted their colleague,2021-04-01 11:58:22.015398+00:00
971,ES2004b,1218.65,B,"use to find it needs to be something that you don't lose, you were saying whistling, maybe",POSITIVE,1,Being respectful,"continuing to bring out discussion on the idea, but trying to guide it",2021-04-01 12:00:02.904383+00:00
971,ES2004b,1233.66,D,That's a super idea.,POSITIVE,19,Being positive,very positive to the idea. Super is a word that really makes people feel good,2021-04-01 12:01:12.262616+00:00
971,ES2004b,1273.88,B,Yeah.,POSITIVE,1,Being agreeable,this is one of many positive affirmations. having short positive feedback encourage people to keep talking,2021-04-01 12:10:36.505885+00:00
971,ES2004b,1340.69,C,"Yeah, yeah that's what I was just yeah.",POSITIVE,3,Being agreeable,Shows agreement and excitement. helps to keep the discussion going,2021-04-01 12:14:27.037603+00:00
621,ES2004b,1108.34,C,Yeah.,NEGATIVE,1,Being passive-aggressive,Having a short answer that seems forced and uninterested in the person's questions harms their confidence.,2021-04-01 12:15:45.451675+00:00
621,ES2004b,1125.85,D,Yes.,NEGATIVE,1,Causing annoyance,Not letting person finish their sentence and interrupting them could cause annoyance on their side.,2021-04-01 12:17:43.282951+00:00
621,ES2004b,1188.63,C,Yeah but um on on that again I just thought 'cause you can get those key chains now and you whistle and then it'll let off a loud noise to let you know where it is so I thought that could be quite a,NEGATIVE,2,Dismissing others,Interrupting B when they were about to voice their opinion harms their willingness to speak next time.,2021-04-01 12:20:56.737932+00:00
621,ES2004b,1283.54,B,Mm.,NEGATIVE,1,Dismissing others,Not being responsive to person's previous question  and sounding to be in own world could harm speakers confidence.,2021-04-01 12:23:41.767138+00:00
514,ES2004b,1097.68,D,Would that imply video use?,NEGATIVE,1,Causing frusturation,This person is expressing frustration with not knowing exactly what the remote is capable of doing,2021-04-01 12:25:16.746007+00:00
621,ES2004b,1306.29,A,Sure.,POSITIVE,1,Being respectful,Being respectful to person's question and not dismissing them but rather giving the idea a chance.,2021-04-01 12:25:37.157505+00:00
790,ES2004b,1094.25,B,"I don't know, what do you think?",POSITIVE,7,Being agreeable,The speaker sought concern of other participants to make sure there is no dictatorship. By so doing all participants are motivated to be involved and contribute their effort towards achieving goals. This is a positive reinforcement aim at ensuring active involvement of all participants.,2021-04-01 12:25:44.431848+00:00
514,ES2004b,1127.26,C,Yeah.,POSITIVE,1,Being agreeable,Showing agreement to the previous person's idea to let them know that the idea is plausable.,2021-04-01 12:26:00.439138+00:00
514,ES2004b,1155.83,C,Ju um just as an idea on the uh speech recognition thing that pr it'd probably be quite expensive to incorporate an entire speech recognition thing and they're not that great anyway.,NEGATIVE,2,Causing frusturation,Provides many negative aspects of an idea that was brought up by a group member,2021-04-01 12:26:41.381619+00:00
514,ES2004b,1233.66,D,That's a super idea.,POSITIVE,19,Being positive,Using very expressive adjectives to expressive positivity makes others feel great,2021-04-01 12:27:41.393668+00:00
