user_id,dataset,timestamp,speaker,line,direction,agree_cnt,reason,possible_comment,created_at
790,ES2004b,1097.68,D,Would that imply video use?,POSITIVE,1,Being agreeable,The speaker sought concern of other participants to make sure there is no dictatorship. By so doing all participants are motivated to be involved and contribute their effort towards achieving goals. This is a positive reinforcement aim at ensuring active involvement of all participants,2021-04-01 12:27:53.932072+00:00
514,ES2004b,1311.92,A,Right.,POSITIVE,1,Being agreeable,Short phrases or words reinforce ideas brought up and let people know that they were heard.,2021-04-01 12:29:30.867584+00:00
790,ES2004b,1095.5,B,"It just said, for T_V_ only.",NEGATIVE,1,Being passive-aggressive,This expression appears rude and disrespectful. Participants will feel demoralized when others show aggression towards them. This will not encourage them to be actively involved during meeting proceedings.,2021-04-01 12:33:10.963546+00:00
790,ES2004b,1154.53,D,<sound: laugh>.,POSITIVE,2,Being positive,Laughing and smiling to each other is a big recipe for positivity and cordiality . By doing so there is less tension and psychological stress on all participants. Each one becomes fully relax to participate during the meeting.,2021-04-01 12:36:11.144513+00:00
977,ES2004b,1496.07,D,"I'm j I really can't get my head round this one, this may have to be postponed to a future meeting but it's something we should think about.",POSITIVE,6,Being respectful,lets people know that its going to be thought of.,2021-04-01 12:37:18.714187+00:00
977,ES2004b,1835.6,A,"I think it will be too much of an effort for a person to for a phone maybe he might walk down the street, but for a remote he will just refer to the manual and all that.",POSITIVE,3,Being positive,giving good explanation of what he would do in a situation.,2021-04-01 12:40:17.742188+00:00
977,ES2004b,1879.56,C,"Um they're they're specially made for the for the mobile phones, but they come with a charger, I mean you could you could bundle a charger in with it but",POSITIVE,3,Being positive,"explaining things in a good manner and helping, its nice.",2021-04-01 12:40:44.887739+00:00
977,ES2004b,1962.61,D,"And we don't w I mean so many remote controls look absolutely identical, these long, brown things with the same coloured buttons all crammed in on the s the surface.",POSITIVE,1,Being agreeable,giving great information about how something isn't up to par and how they should avoid it.,2021-04-01 12:41:20.163265+00:00
977,ES2004b,2031.5,B,"Um, things that are associated with the company in view to trying to incorporate that into the design of the product.",POSITIVE,1,Being respectful,not trying to copy someone elses work or else they could face more repercussions.,2021-04-01 12:42:01.031204+00:00
790,ES2004b,1099.29,C,T yeah yeah.,NEGATIVE,1,Being passive-aggressive,The speaker sound a little aggressive to a participant. I think this was an answer to a question and I think it too hash. Giving annoying answers to participant questions will discourage them from active participation.,2021-04-01 12:45:01.691749+00:00
790,ES2004b,1080.57,B,"It says for T_V_ only, so",NEGATIVE,1,Dismissing others,The comment is very dismissing to other participants ideas and will discourage them from actively expressing their sentiments without fear.,2021-04-01 12:52:53.476342+00:00
556,ES2004b,1094.25,B,"I don't know, what do you think?",POSITIVE,7,Being respectful,"The speaker is asking for the opinion of his team member, showing that he is being cooperative.",2021-04-01 12:54:22.547823+00:00
556,ES2004b,1122.45,B,I think we assume that it's still got play and stop functions and,NEGATIVE,1,Being passive-aggressive,"The speaker is making a statement that is obvious, so it is almost like his tone is kind of dismissive.",2021-04-01 12:54:55.269729+00:00
556,ES2004b,1134.29,D,"Um we didn't really look into that but remember we found that finding that most people only use about uh ten percent of the buttons, I think th th those do tend to be the basic channel-hopping things and on and off for the video, fast-forwarding, so on and I think it's sort of general knowledge that people do find programming their videos a nightmare",POSITIVE,2,Being positive,"The speaker is giving a lot of information, showing that they did their research and came to the meeting prepared.",2021-04-01 12:55:27.716182+00:00
556,ES2004b,1188.63,C,Yeah but um on on that again I just thought 'cause you can get those key chains now and you whistle and then it'll let off a loud noise to let you know where it is so I thought that could be quite a,POSITIVE,1,Being positive,"The speaker is making a joke about a function, showing that he is trying to lighten to the mood",2021-04-01 12:56:14.901661+00:00
790,ES2004b,1083.81,B,"looks like it's just yeah, I think maybe Sky things like that might be incorporated into it, but",NEGATIVE,1,Causing frusturation,Incomplete statement doesn't carry a complete thought and bring about good communication. Participants get frustrated when they cannot make good meaning from speakers talk.,2021-04-01 12:56:28.502281+00:00
556,ES2004b,1233.66,D,That's a super idea.,POSITIVE,19,Being respectful,"The speaker is praising the idea presented by one of his teammates, making them feel good",2021-04-01 12:56:56.206028+00:00
790,ES2004b,1154.53,D,So I don't know if that's something we need to look at.,NEGATIVE,2,Causing frusturation,This statement frustrates participants and discourages them as well.,2021-04-01 13:02:30.381526+00:00
772,ES2004b,1084.48,D,Just channel-hopping.,NEGATIVE,1,Dismissing others,It seems you have interrupted another participants thoughts here which is dismissive.,2021-04-01 14:21:44.898661+00:00
772,ES2004b,1094.25,B,"I don't know, what do you think?",POSITIVE,7,being inclusive,Asking others for their thoughts lets them know that their input is valued.,2021-04-01 14:22:25.646901+00:00
772,ES2004b,1134.29,D,"Um we didn't really look into that but remember we found that finding that most people only use about uh ten percent of the buttons, I think th th those do tend to be the basic channel-hopping things and on and off for the video, fast-forwarding, so on and I think it's sort of general knowledge that people do find programming their videos a nightmare",POSITIVE,2,being inclusive,Using the word we here shows that you think of this group including everyone's input.,2021-04-01 14:24:01.284048+00:00
772,ES2004b,1154.53,D,<sound: laugh>.,NEGATIVE,1,Causing embarrassment,Laughing here may make the last person that spoke feel embarrassed which makes participants uncomfortable,2021-04-01 14:25:23.130156+00:00
772,ES2004b,1167.64,C,"Alright, okay.",POSITIVE,3,Being agreeable,You have shown you agree with other participant and pay attention to their input.,2021-04-01 14:26:19.717124+00:00
654,ES2004b,1154.53,D,<sound: laugh>.,POSITIVE,2,Being positive,Laughter in this situation is designed to lighten the mood and put people's minds at ease.,2021-04-01 15:40:38.016191+00:00
654,ES2004b,1094.25,B,"I don't know, what do you think?",POSITIVE,7,Being agreeable,Asking other people for their opinion is a way to keep them engaged and sharing their ideas.,2021-04-01 15:41:17.853591+00:00
654,ES2004b,1108.66,D,"Mm-hmm, yes.",POSITIVE,2,Being agreeable,Being agreeable helps productivity flow and keeps people moving along their project.,2021-04-01 15:42:18.713742+00:00
654,ES2004b,1127.46,A,Anything about that on the market research or something like regarding whether people want a combined something like that?,POSITIVE,1,Being agreeable,Asking a question like this helps them continue being further productive on refining their design.,2021-04-01 15:43:09.103816+00:00
654,ES2004b,1155.83,C,Ju um just as an idea on the uh speech recognition thing that pr it'd probably be quite expensive to incorporate an entire speech recognition thing and they're not that great anyway.,NEGATIVE,2,Dismissing others,They're shooting down someone else's idea and saying it's not that desirable anyways which would make them feel bad.,2021-04-01 15:43:51.192456+00:00
884,ES2004b,1233.66,D,That's a super idea.,POSITIVE,19,Being positive,he give a great sincere compliment about the other persons idea,2021-04-02 10:19:32.076406+00:00
884,ES2004b,1402.84,B,Were too big.,NEGATIVE,5,Causing embarrassment,pointing out grammatical errors in the other person si degrading,2021-04-02 10:24:26.998300+00:00
884,ES2004b,1456.0,C,Yeah.,POSITIVE,1,Being positive,a positive reinforcement to the other persons idea give support and is a good thing.,2021-04-02 10:25:49.675514+00:00
9,ES2004b,1233.66,D,That's a super idea.,POSITIVE,19,Being agreeable,Telling other group member that their idea is really good.,2021-04-02 10:29:37.722779+00:00
9,ES2004b,1287.72,D,"At the end of the day, th the engineering design is one thing, it's the user interface design that may and th the sort of you know fashionable aspect of it we might have to change for different markets round the world.",POSITIVE,2,Being positive,Makes a very good point and is doing a good job leading the discussion at this point..,2021-04-02 10:30:32.828720+00:00
884,ES2004b,1489.82,D,"Um, R_S_I_ tends to be caused by repetitive small movements.",NEGATIVE,1,Causing embarrassment,the speaker is pointing out a wrong stgatement that could cause tension between the members of the group.,2021-04-02 10:30:56.913772+00:00
9,ES2004b,1402.84,B,Were too big.,NEGATIVE,5,Causing annoyance,"Just repeating the other group member as they are speaking, probably pretty annoying.",2021-04-02 10:31:43.632738+00:00
9,ES2004b,1467.96,B,"It's gonna be the same, so we need to focus on just one thing, not get bogged down in lots of different um possibilities, um.",POSITIVE,5,Being agreeable,Agreeing with other group members but also making a good point and contribution to conversation.,2021-04-02 10:32:17.723032+00:00
9,ES2004b,1662.48,B,No.,NEGATIVE,2,Dismissing others,Disagreeing without any valid point for the disagreement at this point.,2021-04-02 10:33:43.661587+00:00
884,ES2004b,1622.4,C,Video plus.,POSITIVE,3,Being positive,it helps the other speaker to remind him the words he forgot shows support,2021-04-02 10:35:35.743391+00:00
884,ES2004b,1714.61,D,"Excellent, mm-hmm.",POSITIVE,4,Being positive,total agreement with the other person shows support for his idea,2021-04-02 10:38:09.632564+00:00
790,ES2004b,1267.35,D,"Yes, further market research will be needed to kind of focus on what that is, it's gonna be different for a fifteen year old th for somebody who's sixty and also across the world if we're aiming at the international market.",POSITIVE,2,Being agreeable,This positive reinforcement from the participant seeks to motivate and encourage participants to get involved. Psychological safety  is ensured when there is a positive reinforcement.,2021-04-02 12:12:58.756762+00:00
790,ES2004b,1233.66,D,That's a super idea.,POSITIVE,19,Being positive,There is a high sense of positivity with this comment  and it entice every participant to exercise a great optimism towards decisions made under the meeting.,2021-04-02 12:18:25.197362+00:00
790,ES2004b,1277.82,D,"What is um attractive to a trendy New Yorker and what is attractive to a retired South African, I dunno, you get the idea.",NEGATIVE,2,Being sarcastic,Good to be nice to avoid undue tension but being too sarcastic could get some people offendered. This comment is derogatory and will makes some participants feel bad and uneasy about themselves.,2021-04-02 12:22:13.320289+00:00
790,ES2004b,1308.81,A,Alright.,POSITIVE,1,Being agreeable,Being affirmative during meetings is an indication that everyone is actively involved in the decision making. It encourages participants to contribute their best for. successful meeting.,2021-04-02 12:24:59.788497+00:00
790,ES2004b,1236.79,C,Yeah.,POSITIVE,1,Being agreeable,"Agree with participants motivates them to participate well, it is a positive reinforcement and ensures psychological safety.",2021-04-02 12:27:29.066654+00:00
790,ES2004b,1335.28,C,'Kay.,POSITIVE,1,Being positive,This comment is affirmative and promotes active member participation due to motivation.,2021-04-02 12:29:54.904844+00:00
772,ES2004b,1233.66,D,That's a super idea.,POSITIVE,19,Being positive,Giving a positive comment here shows others you are kind.,2021-04-02 13:48:47.596568+00:00
772,ES2004b,1234.92,C,Hmm.,NEGATIVE,1,Being passive-aggressive,Saying hmm here is unclear and could seem you are irritated.,2021-04-02 13:49:31.260373+00:00
772,ES2004b,1247.66,B,"Um so we want logo, we want um",POSITIVE,1,being inclusive,Saying we here reinforces that you are counting on input from others.,2021-04-02 13:50:27.215314+00:00
772,ES2004b,1294.12,C,Yeah.,POSITIVE,1,Being agreeable,You have shown that you agree with the last speaker and also that you are attentive.,2021-04-02 13:51:18.885422+00:00
1045,ES2004b,1554.96,B,"That they want um it to be fashionable, they want it to be trendy and you wouldn't automatically assume associate that with the older generations.",NEGATIVE,7,Dismissing others,This statement is putting down a whole demographic of potential users,2021-04-02 13:52:06.489627+00:00
772,ES2004b,1300.21,A,"So are we talking of a single model or maybe five, six designs",POSITIVE,1,Being respectful,You have shown that you paid attention to the speaker and are interested in what they have contributed,2021-04-02 13:52:51.660022+00:00
1045,ES2004b,1813.45,C,"Yeah, I mean",NEGATIVE,1,Being passive-aggressive,This statement did not validate the previous statement and dismissed the comment. Participant is less likely to participate in the future.,2021-04-02 13:54:18.815495+00:00
1045,ES2004b,2213.46,D,"Right, so it's kind of doing away with the programming feature?",POSITIVE,1,Being agreeable,D clarifies the position and reinforces the stance  by adding validation to previous message,2021-04-02 14:27:23.937980+00:00
1045,ES2004b,2339.29,B,Um and I'll be able to not answer them.,POSITIVE,3,Being positive,This person is being playful it seems and ending on a positive note that they can all laugh about.,2021-04-02 14:28:59.214039+00:00
1045,ES2004b,2300.12,B,"I think you might get guidance, but um",NEGATIVE,1,Causing embarrassment,"This statement does not dismiss or agree to any comment and causes confusion regarding the directions and instructions, more information is needed a statement to reinforce or reintroduce a question would be best",2021-04-02 14:33:38.272997+00:00
273,ES2004b,1233.66,D,That's a super idea.,POSITIVE,19,Being positive,Positive comments like this inspire others to want to tell their ideas to the group as well as give positive feedback of their own.,2021-04-02 17:52:42.365849+00:00
273,ES2004b,1378.74,B,"oh yeah that's obvious what that's for and it's not daunting to maybe the older generations, um",NEGATIVE,9,being ageist,"This comment may be intended to help grow sales, but it gives the impression that older people cannot use technology well. There may be some people in the group that are older and may be offended by a comment like this. Just say ""people that aren't tech savvy"" or something less discriminatory.",2021-04-02 17:55:47.674131+00:00
273,ES2004b,1467.96,B,"It's gonna be the same, so we need to focus on just one thing, not get bogged down in lots of different um possibilities, um.",NEGATIVE,11,Dismissing others,"This comment makes it seem like other ideas and concepts are not being listened to. If this is a brainstorming session, ideas and suggestions should not be stifled or dismissed.",2021-04-02 17:57:23.610718+00:00
273,ES2004b,1554.96,B,"That they want um it to be fashionable, they want it to be trendy and you wouldn't automatically assume associate that with the older generations.",NEGATIVE,7,discriminatory,This sort of comment is discriminatory. Just assuming older people would not be interested in something trendy is terribly ageist and not conducive to a healthy environment for good ideas.,2021-04-02 17:59:48.957178+00:00
273,ES2004b,1698.1,D,Superb.,POSITIVE,3,Being positive,Putting out a positive comment like this reminds people that their ideas are being valued and considered. It makes others feel comfortable making their own suggestions and participating in the discussion.,2021-04-02 18:01:34.283337+00:00
654,ES2004b,1233.66,D,That's a super idea.,POSITIVE,19,Being positive,Reinforcing someone else's idea is good makes them happy and more likely to share their ideas again in the future.,2021-04-02 18:06:14.488054+00:00
654,ES2004b,1267.35,D,"Yes, further market research will be needed to kind of focus on what that is, it's gonna be different for a fifteen year old th for somebody who's sixty and also across the world if we're aiming at the international market.",POSITIVE,2,Being positive,They're being constructive and supportive by agreeing with another group member and offering additional details about it.,2021-04-02 18:07:03.399777+00:00
654,ES2004b,1306.3,C,Well y yeah you could you could have a number of different designs I mean inside they'd be essentially exactly the same.,POSITIVE,1,Being positive,"They're agreeing with someone else and explaining why the idea is good, which is supportive.",2021-04-02 18:07:50.665168+00:00
654,ES2004b,1340.69,C,"Yeah, yeah that's what I was just yeah.",POSITIVE,3,Being agreeable,They're agreeing with someone and being supportive of their ideas.,2021-04-02 18:08:29.440785+00:00
654,ES2004b,1313.49,A,The features could be same and the body could look slightly different.,POSITIVE,1,Being agreeable,Agreeing with someone's idea and explaining why it's a good idea.,2021-04-02 18:10:22.992649+00:00
1066,ES2004b,1233.66,D,That's a super idea.,POSITIVE,19,Being positive,By letting them know that their idea is a good one and appreciated,2021-04-02 19:08:27.632671+00:00
1066,ES2004b,1313.27,C,"Just yeah, yeah.",NEGATIVE,1,Dismissing others,Sounds like they r just accepting the answer and dont really value the opinion,2021-04-02 19:10:00.415112+00:00
1066,ES2004b,1378.74,B,"oh yeah that's obvious what that's for and it's not daunting to maybe the older generations, um",NEGATIVE,9,Dismissing others,Sounds like they are dismissing what they are saying by saying that their opinion is obvious,2021-04-02 19:11:15.482150+00:00
1066,ES2004b,1406.93,C,they're c uh just generally Japanese people have smaller hands so they couldn't get round the controller which is uh so if you I don't know what 'cause you obviously you can have bigger buttons for some countries or something and smaller ones for others.,NEGATIVE,9,Causing embarrassment,"That would cause embarrassment or anger if someone is the meeting is asian or if they have a family member hat is, it is a stereotype",2021-04-02 19:12:13.215881+00:00
1066,ES2004b,1467.96,B,"It's gonna be the same, so we need to focus on just one thing, not get bogged down in lots of different um possibilities, um.",NEGATIVE,11,Dismissing others,Pretty much insinuating that the ideas being brought up are useless,2021-04-02 19:13:38.011588+00:00
1075,ES2004b,1233.66,D,That's a super idea.,POSITIVE,19,Being positive,"Happily exclaiming ""that's a super idea"" is reinforcing positive energy within the group. They seem to be in concurrence with said idea",2021-04-02 22:18:15.374857+00:00
1075,ES2004b,1355.18,B,"You don't have to press it, you just have to put your thumb onto it.",POSITIVE,4,Being respectful,It reinforced being respectful by clearly stating the idea correctly for all.,2021-04-02 22:23:47.841134+00:00
1075,ES2004b,1378.74,B,"oh yeah that's obvious what that's for and it's not daunting to maybe the older generations, um",NEGATIVE,9,Being passive-aggressive,"Calling things to older generations daunting seems careless. It reinforces negativity due to not focusing on the positive. The older generation are just kind of written off, passed by",2021-04-02 22:26:17.841575+00:00
1075,ES2004b,1406.93,C,they're c uh just generally Japanese people have smaller hands so they couldn't get round the controller which is uh so if you I don't know what 'cause you obviously you can have bigger buttons for some countries or something and smaller ones for others.,POSITIVE,2,Being clear and confident,They explained clearly the reasoning behind the idea. It was easy to understand and not offensive.,2021-04-02 22:28:43.253245+00:00
1075,ES2004b,1514.24,C,"Yeah, speech recognition, but yeah.",NEGATIVE,2,Causing annoyance,Cut the other off mid sentence and thats not the first occurence. Reinforced harm because it's a display of rude behavior,2021-04-02 22:32:05.660364+00:00
1075,ES2004b,1665.69,D,"Right, I've not come across that function but it sounds wonderful",POSITIVE,6,Being positive,Pleasantly agrees that the idea is wonderful. That is positive and boosts everyone,2021-04-02 22:34:07.012029+00:00
1075,ES2004b,1277.82,D,"What is um attractive to a trendy New Yorker and what is attractive to a retired South African, I dunno, you get the idea.",NEGATIVE,2,Dismissing others,Probably doesn't think this is negative but it is. Why couldn't  the examples of people be switched instead of typical? Who's to say the New Yorker is trendy and the South African retired? Just seems disrepectful,2021-04-02 22:36:36.790381+00:00
877,ES2004b,1233.66,D,That's a super idea.,POSITIVE,19,Being positive,Very honest and positive feedback on your team member's idea.,2021-04-03 01:57:26.390446+00:00
877,ES2004b,1239.36,B,the third thing was that we have to make sure the corporate image is very much incorporated into the handset.,NEGATIVE,1,Causing embarrassment,"no positive feedback on the colleague's idea, it was dismissive, just very corporate focused",2021-04-03 02:00:18.829288+00:00
877,ES2004b,1287.72,D,"At the end of the day, th the engineering design is one thing, it's the user interface design that may and th the sort of you know fashionable aspect of it we might have to change for different markets round the world.",POSITIVE,2,Being respectful,Very understanding comment and logical explanation of varying market preferences,2021-04-03 02:03:05.626972+00:00
877,ES2004b,1320.38,B,"What about you were talking about the buttons, um the controls that are coming out now have kind of big, rubber buttons, not tiny little one, big, rubber buttons, but what about, I mean, 'cause we got to make it original,",NEGATIVE,4,Causing annoyance,you have a logical comment but abrasive approach with a demanding tone.,2021-04-03 02:05:26.111790+00:00
877,ES2004b,1344.32,B,"Um so you it's like a little panel that you touch rather than a button which shouldn't wear out as much either, not sure about the",NEGATIVE,2,Being sarcastic,need to ask feature questions in a more methodical logical tone,2021-04-03 02:07:48.324238+00:00
877,ES2004b,1406.93,C,they're c uh just generally Japanese people have smaller hands so they couldn't get round the controller which is uh so if you I don't know what 'cause you obviously you can have bigger buttons for some countries or something and smaller ones for others.,POSITIVE,2,Being agreeable,being very informative to help engage the team and generate ideas.,2021-04-03 02:09:40.130181+00:00
877,ES2004b,1501.92,C,I yeah I was just thinking about how you could combat that 'cause without without doing something where you have to move your arm around to change the channel and it becomes yeah.,POSITIVE,4,Being agreeable,Good sharing potential physical user issues with the design aspects of the remote.,2021-04-03 02:15:12.229217+00:00
9,ES2004b,1370.01,D,Yes it will appeal to sections of the market def,POSITIVE,4,Being agreeable,Agreeing to point made by other group member that different parts of the market will want different things.,2021-04-05 09:49:02.801379+00:00
9,ES2004b,1446.33,A,"Maybe for U_S_ and all you can have a slightly bigger remote control and maybe in Japan and all you need to have a small, yeah.",NEGATIVE,4,Dismissing others,"Saying that people in japan have smaller hands, so a smaller remote will work.",2021-04-05 09:49:43.754764+00:00
9,ES2004b,1467.96,B,"It's gonna be the same, so we need to focus on just one thing, not get bogged down in lots of different um possibilities, um.",NEGATIVE,11,Dismissing others,"Saying that they should not spend their time focusing on multiple ideas, but put all their attention on 1.",2021-04-05 09:50:22.273908+00:00
9,ES2004b,1595.38,D,"you know focus on where the idea will be taken up, first it's most likely to be taken up first of all where the main purchasing power is coming from for a product like this.",POSITIVE,1,Being respectful,Makes a good point and is keeping other group members in engaged.,2021-04-05 09:51:37.513912+00:00
9,ES2004b,1665.69,D,"Right, I've not come across that function but it sounds wonderful",POSITIVE,6,Being positive,Making a joke that gets others to laugh. This builds group rapport and makes everyone feel comfortable.,2021-04-05 09:52:35.499976+00:00
874,ES2004b,1424.36,A,"Yeah, uh maybe to as uh it it was indicated that uh uh risk uh of uh repeated use, the injuries, maybe a touch screen could be a better option for that.",POSITIVE,7,Being positive,Here this commenter is bringing up a good point about how an alternative feature could help to avoid injuries. This is great and helpful input!,2021-04-05 12:39:12.064641+00:00
874,ES2004b,1512.86,B,"Or a speech recognition, which is extremely expensive, I think that's the only way that you kind of avoid",POSITIVE,1,Being positive,Here this person is coming up with an alternative way to avoid the problem of RSI. This is great input and certainly adds to the conversation of group members.,2021-04-05 12:40:33.338944+00:00
