user_id,dataset,timestamp,speaker,line,direction,agree_cnt,reason,possible_comment,created_at
1299,ES2007c,1111.7,C,"So, the key layout and design are really crucial.",POSITIVE,1,Re-enforces importance of job,Reminds the team that they are an important part of this process.,2021-04-07 18:55:36.188450+00:00
1299,ES2007c,1127.99,C,good layout and bad layout,NEGATIVE,1,Causing embarrassment,"If the example included work of previous team members as a ""bad example"" this could harm the team.  They may also worry about their work being brought up in future meeting as the ""bad example"".  Instead of ""bad"" give specific attributes to why the design was lacking.",2021-04-07 18:58:13.512547+00:00
1299,ES2007c,1136.63,C,"So this would be an example of bad layout, where you have volume up and volume down, but they have a V_ on both of them, so uh",NEGATIVE,1,Causing embarrassment,"Again, this may reference work that a member of their current team had done on a previous project.  Be specific areas of improvement instead of just judging something as ""good"" or ""bad""",2021-04-07 19:00:04.065668+00:00
1299,ES2007c,1148.4,A,Do we have an uh example of a good one?,NEGATIVE,6,Being passive-aggressive,"This is a passive aggressive way of asking about what attributes are wanted while acknowledging the judgmental tone of ""C"" saying something was a ""bad layout""",2021-04-07 19:01:49.889059+00:00
1299,ES2007c,1167.3,C,"yeah, I th I think my personal preferences of we've all kind of talked about and seemed to be on the same page um.",NEGATIVE,1,Self Centered Opinion,"He is talking about personal preference for a product that is going to be made for consumers.  His personal preference does not matter, what the consumer has expressed interest in is what matters.",2021-04-07 19:03:41.461304+00:00
1299,ES2007c,1174.75,C,Uh so I was against the speech recognition and against going uh towards anything in in a niche sense.,NEGATIVE,1,Self Centered Opinion,"Options should be decided on consumer preference, not unilaterally according to the preference of a team leader.",2021-04-07 19:04:59.702886+00:00
1299,ES2007c,1182.85,C,I didn't I didn't think the spinning-wheel or the uh L_C_ display were were crucial for us.,NEGATIVE,1,Dismissing others,Dismissing the ideas by saying they were not important or crucial.  Someone had input on that decision that may hesitate to provide input in the future.,2021-04-07 19:06:23.777598+00:00
1299,ES2007c,1192.2,A,Well let's um so w what are our definite decisions on this then as a team?,POSITIVE,7,Being respectful,Asking for feedback as a team.  Encourages group talk and decision making.,2021-04-07 19:07:06.447173+00:00
1299,ES2007c,1257.11,C,"Um it seems like we wouldn't wanna make it too busy and too sort of gaudy, but um",NEGATIVE,3,Dismissing others,Gaudy is judgmental.  Stick to the operation of the remote and consumer preferences.,2021-04-07 19:09:22.831628+00:00
1299,ES2007c,1280.85,A,"Yeah, I don't have any other questions on this.",NEGATIVE,1,Unilateral Decision,Statements like this typically close  a meeting.  He has attempted to close it without the input of the other team members,2021-04-07 19:12:30.805244+00:00
1299,ES2007c,1333.92,D,"Well, I'm just basically letting you know what's happening in the markets",POSITIVE,1,Refocuses meeting,This statement brings the dialog to where it needs to be.  What the market determines is important.,2021-04-07 19:14:13.468325+00:00
1309,ES2007c,1004.34,C,"Uh I also took uh Reissa's marketing findings from the last meeting into consideration um, 'cause I think that's that's crucial as far as uh what keys we're going to inc inclu what buttons we are going to include and and how they're laid out.",POSITIVE,2,Confirming the input of others,"You have confirmed that you listen to, respect and include the input of others in your work actions.",2021-04-07 20:15:59.832749+00:00
1309,ES2007c,1040.88,C,It's it's pointless.,NEGATIVE,5,Causing embarrassment,"Your comment could embarrass those who supported this idea.  Rather than using the word ""pointless"", you might say ""We decided that we would not be using this idea for this product.""",2021-04-07 20:18:47.403130+00:00
1309,ES2007c,1093.64,C,"<gap>, or uh something for the elderly, where the remote's very large and the buttons are very large and there's only a few buttons.",NEGATIVE,2,Stereotyping,"If anyone involved in this meeting is older, they could be offended by this comment.  It might be better to say ""those with diminished abilities"" rather than ""elderly"".",2021-04-07 20:22:24.681371+00:00
1309,ES2007c,1148.4,A,Do we have an uh example of a good one?,NEGATIVE,6,Dismissing others,"Those that liked this design might feel slighted by your comment.  Maybe better to just say, ""are there any other examples"".",2021-04-07 20:25:02.733879+00:00
1309,ES2007c,1155.55,A,Brilliant.,NEGATIVE,1,Being sarcastic,Your comment could be perceived as sarcastic by those who favor this design.,2021-04-07 20:28:47.411264+00:00
1309,ES2007c,1072.28,D,That does get annoying.,POSITIVE,5,Being agreeable,Your comment shows that you're engaged in the conversation and agree with the group.,2021-04-07 20:30:57.262019+00:00
1309,ES2007c,1192.2,A,Well let's um so w what are our definite decisions on this then as a team?,POSITIVE,7,Being respectful,Your comment shows you respect the groups decisions and are interesting in confirming them.,2021-04-07 20:32:41.778423+00:00
1309,ES2007c,1211.47,A,Just the simple s simple straight set of buttons.,POSITIVE,1,Being agreeable,Your comment confirms you are engaged in the discussion and that you agree with the other speaker.,2021-04-07 20:33:54.521819+00:00
1309,ES2007c,1375.78,A,"Yeah, why should people buy this when they're already got a remote that came with the T_V_?",POSITIVE,5,Confirming the point of another speaker,Your comment confirms that you have listened to and agree with the other speaker.,2021-04-07 20:36:07.572084+00:00
1309,ES2007c,1377.85,D,Exactly.,POSITIVE,10,Being agreeable,You have confirmed acknowledgement and agreement with the other speaker.,2021-04-07 20:36:59.302114+00:00
1309,ES2007c,1389.03,A,What's that mean?,NEGATIVE,2,Causing embarrassment,"It might be less confrontational to say ""how do they define that"".",2021-04-07 20:38:14.569658+00:00
1309,ES2007c,1450.29,A,"Of course, they do.",NEGATIVE,5,Dismissing others,"Your comment directly confronts the other speaker.  It might be better to ask, ""do you think so?"".",2021-04-07 20:41:41.812175+00:00
1311,ES2007c,1155.55,A,Brilliant.,POSITIVE,6,Being positive,A is telling speaker C that what they've presented is brilliant and reinforcing them.,2021-04-07 20:48:59.285820+00:00
1311,ES2007c,1182.57,A,Mm-hmm.,POSITIVE,1,Being agreeable,"A is agreeing with what C is saying, making C more confident in what they're saying.",2021-04-07 20:49:42.633315+00:00
1311,ES2007c,1220.45,A,Yeah.,POSITIVE,1,Being agreeable,"A is agreeing about the design that C is proposing, again making C more sure about what they are proposing.",2021-04-07 20:52:54.767972+00:00
1311,ES2007c,1257.11,C,"Um it seems like we wouldn't wanna make it too busy and too sort of gaudy, but um",NEGATIVE,3,Dismissing others,C is dismissing A's idea by explaining why it's not a good idea,2021-04-07 20:54:03.964379+00:00
1311,ES2007c,1308.45,A,"Yeah, the button that just does that, yeah.",POSITIVE,1,Being agreeable,A is satisfied with C's explanation and is showing agreement.,2021-04-07 20:56:54.675515+00:00
1311,ES2007c,1377.85,D,Exactly.,POSITIVE,10,Being agreeable,D is acknowledging that A understands what they're saying and is reinforcing this.,2021-04-07 20:58:00.679450+00:00
1311,ES2007c,1379.8,C,Yeah.,POSITIVE,2,Being agreeable,C is in agreement with A and D and is expressing this so that they are all on the same page.,2021-04-07 20:58:29.558130+00:00
1311,ES2007c,1389.84,D,<sound: laugh>,NEGATIVE,2,Causing embarrassment,"D is laughing at a question that was posed by A, which could be seen as D thinking the question was dumb.",2021-04-07 20:59:44.853491+00:00
1311,ES2007c,1405.33,D,Yeah.,POSITIVE,1,Being agreeable,D is acknowledging the issue that A is bringing up.,2021-04-07 21:00:39.820616+00:00
1311,ES2007c,1406.91,C,Yeah.,POSITIVE,1,Being agreeable,C is seconding D's acknowledgement of the issue that A is bringing to attention.,2021-04-07 21:01:09.087350+00:00
610,ES2007c,1040.88,C,It's it's pointless.,NEGATIVE,5,Dismissing others,"It depends on the context and if someone specifically suggested this speech recognition interface... because if someone had suggested it, it's probably very mean to call the idea pointless",2021-04-07 21:41:01.193042+00:00
610,ES2007c,1037.66,C,"I guess, we we basically vetoed that idea.",NEGATIVE,5,Dismissing others,"It depends on the context and if someone specifically suggested this idea. If someone did propose this, it's probably very mean to say everyone vetoed it",2021-04-07 21:42:01.651743+00:00
610,ES2007c,1072.28,D,That does get annoying.,POSITIVE,5,Being agreeable,Responds to C's comment that something would be bad by echoing that sentiment,2021-04-07 21:47:01.378406+00:00
610,ES2007c,1078.74,C,"we're interested in in something more general, but they suggested uh, you know, going i a little bit into a a niche, like either gearing our remote towards kids, where you could have",NEGATIVE,1,Dismissing others,"Says what someone else suggested, but says the team has practically rejected it already - which might make other teammates scared to share their true feelings",2021-04-07 21:48:20.932385+00:00
610,ES2007c,1101.7,C,"But you know we can we can discuss this, but it sounded like from our last meeting we really wanted something that was general, but done well.",NEGATIVE,1,Dismissing others,"Again, says what someone else suggested, but says the team has practically rejected it already - which might make other teammates scared to share their true feelings",2021-04-07 21:49:00.650168+00:00
915,ES2007c,1404.84,A,"Okay, now the trouble is is we've already decided that we're going with the stuff that works already, that's cheap.",NEGATIVE,5,Being sarcastic,The pretty much dismissed the above comments in an unproductive manner,2021-04-08 10:33:30.701328+00:00
915,ES2007c,1456.39,D,"Yeah, but it looks good.",POSITIVE,2,Being positive,The clearly pointed out that the remote is aesthetically pleasing.,2021-04-08 10:35:20.507673+00:00
915,ES2007c,1462.47,D,<sound: laugh>,NEGATIVE,2,Dismissing others,This participant decided to laugh at the previous comment that was valid but not meant to be funny. This is a waste of space and a distraction.,2021-04-08 10:37:49.775955+00:00
915,ES2007c,1531.2,B,"I with the television, yeah.",POSITIVE,1,Being agreeable,This participant knows what they prefer and is encouraging it.,2021-04-08 10:40:17.101179+00:00
915,ES2007c,1579.3,A,"Yeah, this that's that's very good.",POSITIVE,6,Being positive,They like what what they hear and are actively making it know which more of is needed.,2021-04-08 10:42:42.869329+00:00
915,ES2007c,1584.29,A,And and this is all tying in very nicely.,POSITIVE,5,Being positive,"Giving some positive, encouraging feedback which seems to be few and far between.",2021-04-08 10:43:34.401782+00:00
767,ES2007c,1375.78,A,"Yeah, why should people buy this when they're already got a remote that came with the T_V_?",POSITIVE,5,Being agreeable,going off what speaker D said and agreeing with them keeps the conversation positive.,2021-04-08 10:47:58.817782+00:00
767,ES2007c,1376.51,D,Yep.,POSITIVE,1,Being agreeable,agreeing with speaker A's statement shows there is a mutual respect and acknowledgement that they agree on the topic.,2021-04-08 10:48:47.560304+00:00
767,ES2007c,1377.85,D,Exactly.,POSITIVE,10,Being agreeable,agreeing with speaker A's statement shows there is a mutual respect and acknowledgement that they agree on the topic.,2021-04-08 10:48:58.722703+00:00
767,ES2007c,1379.8,C,Yeah.,POSITIVE,2,Being agreeable,agreeing with speaker A&D's statement shows there is a mutual respect and acknowledgement that they agree on the topic.,2021-04-08 10:49:33.437976+00:00
767,ES2007c,1450.29,A,"Of course, they do.",NEGATIVE,5,Dismissing others,"disagreeing with speaker D, and essentially telling them they're wrong, may hurt their feelings",2021-04-08 10:51:12.630709+00:00
767,ES2007c,1463.16,A,"Okay, well, what do you two think about this?",POSITIVE,7,Being respectful,asking for other's opinions in a meeting is respectful and shows they care about opinions outside of their own.,2021-04-08 10:51:55.992893+00:00
767,ES2007c,1519.19,A,"No, that would be your telephone",NEGATIVE,3,Dismissing others,speaker A is dismissing their ideas without actually listening,2021-04-08 10:53:51.678540+00:00
1281,ES2007c,1467.22,C,So is is the advantage of Bluetooth that you can just like synchronise it with other,POSITIVE,1,Being respectful,Good comment because he is giving good useful advice here,2021-04-08 11:20:46.593074+00:00
1281,ES2007c,1463.16,A,"Okay, well, what do you two think about this?",POSITIVE,7,Being respectful,He is asking a simple question here so nothing wrong,2021-04-08 11:21:07.401623+00:00
1281,ES2007c,1451.99,A,"One hundred per cent, that's your first thing, you go, oh I'm not gonna buy that, 'cause I dunno if it works or not.",NEGATIVE,2,Being sarcastic,Not a nice comment and not being productive in the manner of speech,2021-04-08 11:21:35.530025+00:00
1281,ES2007c,1456.39,D,"Yeah, but it looks good.",POSITIVE,2,Being positive,giving a good positive comment here no problems at all,2021-04-08 11:21:54.916123+00:00
1281,ES2007c,1450.29,A,"Of course, they do.",POSITIVE,2,Being positive,making a simple comment here and nothing wrong with it,2021-04-08 11:22:18.461924+00:00
9,ES2007c,1375.78,A,"Yeah, why should people buy this when they're already got a remote that came with the T_V_?",POSITIVE,5,Being agreeable,Agreeing with other group member that this remote must set itself apart from other remotes.,2021-04-08 12:01:02.689194+00:00
9,ES2007c,1399.14,C,"Well it should be it should be maybe cutting edge in some sense, I mean have something that's little more technologically advanced than what's on the market.",POSITIVE,2,Being respectful,Helping to clarify to other group member what they mean by innovative technologically.,2021-04-08 12:01:33.650133+00:00
9,ES2007c,1530.25,A,"Nah, the televi the television would have to be a Bluetooth compatible, basically.",POSITIVE,1,Being respectful,Helping to clarify what it means for the remote to have bluetooth compatibility.,2021-04-08 12:03:53.534412+00:00
9,ES2007c,1574.26,B,"It's been done for watches, but I haven't seen that for remotes, yet.",POSITIVE,1,Being positive,Being positive in terms of the idea being new and being something people have not seen before.,2021-04-08 12:04:14.350207+00:00
9,ES2007c,1584.29,A,And and this is all tying in very nicely.,POSITIVE,5,Being positive,Excited about the slogan on not ever having to use batteries due to the kinetic energy feature.,2021-04-08 12:04:52.524651+00:00
958,ES2007c,1377.85,D,Exactly.,POSITIVE,10,Being respectful,"Acknowledges what someone else said and encourages it, says it's correct",2021-04-08 13:45:05.756351+00:00
958,ES2007c,1450.29,A,"Of course, they do.",NEGATIVE,5,Dismissing others,Directly contradicting what was just said and disagreeing in a kind of forceful way,2021-04-08 13:45:54.592324+00:00
958,ES2007c,1463.16,A,"Okay, well, what do you two think about this?",POSITIVE,7,Being respectful,Encourages the other group members to participate and give input on ideas,2021-04-08 13:46:28.789505+00:00
958,ES2007c,1519.19,A,"No, that would be your telephone",NEGATIVE,3,Dismissing others,"Dismissing the idea in a kind of forceful way, not very respectful or appreciative of their input",2021-04-08 13:47:06.969481+00:00
958,ES2007c,1579.3,A,"Yeah, this that's that's very good.",POSITIVE,6,Being positive,Encouraging the participants ideas and giving them positive feedback on their ideas,2021-04-08 13:47:44.258651+00:00
1171,ES2007c,1360.17,D,these are like most important aspects like that we really need to which we've already probably discussed.,POSITIVE,3,Being respectful,This line shows respect for another's comment and has a positive aspect.,2021-04-08 14:05:47.417372+00:00
1171,ES2007c,1375.78,A,"Yeah, why should people buy this when they're already got a remote that came with the T_V_?",NEGATIVE,2,Dismissing others,This comment is dismissive of another person's idea and could have shows more respect.,2021-04-08 14:06:15.967629+00:00
1171,ES2007c,1380.11,D,"Um second, uh it should be technologically innovative innovative.",NEGATIVE,1,Being sarcastic,This comment has sarcasm in in and does not show respect for others.,2021-04-08 14:06:43.024035+00:00
1171,ES2007c,1404.84,A,"Okay, now the trouble is is we've already decided that we're going with the stuff that works already, that's cheap.",POSITIVE,1,Being respectful,This is a respectfully criticizing statement about another person's comment.,2021-04-08 14:07:10.569649+00:00
1171,ES2007c,1418.95,C,If that's what people want then we maybe we're going in the wrong direction.,POSITIVE,1,Being respectful,This line and comment respectfully disagrees with another persons comment.,2021-04-08 14:07:31.488312+00:00
772,ES2007c,1360.17,D,these are like most important aspects like that we really need to which we've already probably discussed.,POSITIVE,3,Being respectful,Saying we here shows you value each member of the group and you count on their feedback.,2021-04-08 14:08:43.047831+00:00
772,ES2007c,1375.78,A,"Yeah, why should people buy this when they're already got a remote that came with the T_V_?",POSITIVE,5,Being positive,Feedback here is positive and shows you agree and are paying attention.,2021-04-08 14:09:14.354633+00:00
772,ES2007c,1389.84,D,<sound: laugh>,NEGATIVE,2,Causing embarrassment,Laughing when someone asks a question can cause embarrassment and make them not want to speak up.,2021-04-08 14:10:01.740618+00:00
772,ES2007c,1450.29,A,"Of course, they do.",NEGATIVE,5,Dismissing others,You are discounting someone's feedback which makes people not want to share.,2021-04-08 14:11:16.129690+00:00
772,ES2007c,1462.47,D,<sound: laugh>,NEGATIVE,2,Dismissing others,Laughing here seems dismissive of the point the other speaker is making.,2021-04-08 14:12:07.685665+00:00
112,ES2007c,1463.16,A,"Okay, well, what do you two think about this?",POSITIVE,7,Being respectful,They are asking for the opinions of the other people and valuing their opinion.,2021-04-08 14:28:46.469206+00:00
112,ES2007c,1607.17,A,"Yeah, that's a great idea.",POSITIVE,12,Being positive,They are saying that the person's idea is great giving positive feedback on the comments.,2021-04-08 14:31:22.359885+00:00
112,ES2007c,1696.06,C,"Yeah, that's great.",POSITIVE,4,Being positive,They were giving encouragement that the speaker was right and encouraging more talk.,2021-04-08 14:39:53.809802+00:00
790,ES2007c,1375.78,A,"Yeah, why should people buy this when they're already got a remote that came with the T_V_?",POSITIVE,5,Being positive,It's a good practice to tolerate others and give them positive self image.,2021-04-08 14:40:49.270104+00:00
790,ES2007c,1398.67,D,It should work.,POSITIVE,1,Being positive,Staying positive is a good practice to ensure participants are motivated to work towards it.,2021-04-08 14:42:09.674658+00:00
112,ES2007c,2041.57,B,Cool.,POSITIVE,3,Being positive,They are promoting the person to say more because they value the speaking.,2021-04-08 14:42:43.898776+00:00
790,ES2007c,1377.85,D,Exactly.,POSITIVE,10,Being agreeable,Actively agreeing with other is a good practice to exercise tolerance and plan together.,2021-04-08 14:45:50.561968+00:00
112,ES2007c,1805.09,C,Yeah.,POSITIVE,2,Being agreeable,They are showing they are paying attention to the speaker encouraging more conversations.,2021-04-08 14:47:43.567516+00:00
790,ES2007c,1450.29,A,"Of course, they do.",POSITIVE,2,Being agreeable,It's a good practice to tolerate others and ensure mutual participation of each participant.,2021-04-08 14:48:44.453977+00:00
790,ES2007c,1439.0,D,"<sound: laugh>, like people and um when it comes to marketing like that's what people go for, they don't really care whether, you know,",POSITIVE,1,Being positive,Staying positive and making jokes is a good practice to ease tension and ensure peaceful meeting environment.,2021-04-08 14:55:32.302353+00:00
459,ES2007c,1360.17,D,these are like most important aspects like that we really need to which we've already probably discussed.,POSITIVE,3,Being positive,This reinforces the need to stay focused and keeps the team focused on the task.,2021-04-08 16:05:33.799201+00:00
459,ES2007c,1375.78,A,"Yeah, why should people buy this when they're already got a remote that came with the T_V_?",NEGATIVE,2,Dismissing others,it can make others feel like there is no point in doing this new design.,2021-04-08 16:05:51.670050+00:00
459,ES2007c,1404.84,A,"Okay, now the trouble is is we've already decided that we're going with the stuff that works already, that's cheap.",NEGATIVE,5,Causing frusturation,"it raises questions about the decisions already made by the team , which can make others feel like they have wasted some time.",2021-04-08 16:06:42.658345+00:00
459,ES2007c,1421.73,C,And it's it's not technologically innovative either.,NEGATIVE,1,Causing frusturation,This tone undermines the work of the team and can make some feel like they are not doing a good enough job.,2021-04-08 16:07:15.952349+00:00
459,ES2007c,1451.99,A,"One hundred per cent, that's your first thing, you go, oh I'm not gonna buy that, 'cause I dunno if it works or not.",NEGATIVE,2,Being passive-aggressive,The tone is slightly aggressive and dismissed the thoughts of the other team members.,2021-04-08 16:07:49.869181+00:00
1183,ES2007c,1584.29,A,And and this is all tying in very nicely.,POSITIVE,5,Being positive,This person is being positive about the project and is stating this to the group.,2021-04-08 17:27:53.099888+00:00
571,ES2007c,1389.03,A,What's that mean?,NEGATIVE,2,Being passive-aggressive,They questioned the person in a somewhat rude way and should have been nicer about it.,2021-04-08 18:08:35.845212+00:00
571,ES2007c,1418.95,C,If that's what people want then we maybe we're going in the wrong direction.,NEGATIVE,2,Dismissing others,They are being overly critical of the idea and not having an open mind.,2021-04-08 18:09:22.316704+00:00
571,ES2007c,1485.27,A,"It would that would mean you'd need a television that has Bluetooth in it, which no no television does, does it?",NEGATIVE,1,Dismissing others,They interrupted the speaker before they were able to finish their idea.,2021-04-08 18:09:51.850409+00:00
571,ES2007c,1579.3,A,"Yeah, this that's that's very good.",POSITIVE,6,Being positive,They are being supportive and saying that the idea given was good.,2021-04-08 18:10:29.151621+00:00
571,ES2007c,1602.45,A,"But yeah, by the squeezing it the",NEGATIVE,2,Dismissing others,This user is cutting off the same person multiple times when they are trying to speak.,2021-04-08 18:10:56.825691+00:00
961,ES2007c,1595.749,B,<sound: laugh>,NEGATIVE,1,Dismissing others,Laughing at someone is a way of dismissing their opinions.,2021-04-09 10:57:32.278857+00:00
961,ES2007c,1607.17,A,"Yeah, that's a great idea.",POSITIVE,12,Being respectful,Stating that someone else has a great idea is showing some great respect for them.,2021-04-09 10:57:59.663848+00:00
961,ES2007c,1610.81,A,Well done.,POSITIVE,8,Being respectful,Telling someone that they have done well in a job shows them respect for their work.,2021-04-09 10:58:25.992878+00:00
961,ES2007c,1658.17,C,"Yeah, that's great for us.",POSITIVE,3,Being positive,Feeling that something is great shows a positive reaction to that thing.,2021-04-09 10:59:07.062438+00:00
961,ES2007c,1686.04,C,Right.,POSITIVE,1,Being agreeable,Person C is reiterating that they are in fact moving in the right direction.,2021-04-09 10:59:32.856422+00:00
1404,ES2007c,1607.17,A,"Yeah, that's a great idea.",POSITIVE,12,Being positive,This comment encourages participation by acknowledging input of team members and praising good ideas,2021-04-09 11:45:02.383335+00:00
1404,ES2007c,1610.81,A,Well done.,POSITIVE,8,Being positive,Again this reinforces team member input by praising positive ideas,2021-04-09 11:46:16.121708+00:00
1404,ES2007c,1780.72,D,"I think, it's it should be I mean, what do you associate with rubber?",NEGATIVE,2,Causing embarrassment,This could be misconstrued in a sexual way causing a team member to feel embarrassed or harassed by this comment,2021-04-09 11:51:18.389506+00:00
1404,ES2007c,1788.6,D,"Okay, sor I sorry, I used the wrong word, what do you associate with the mate the material",POSITIVE,1,Being respectful,This was a great example of apologizing and clarifying of a comment that could be misconstrued,2021-04-09 11:52:41.773627+00:00
1124,ES2007c,1607.17,A,"Yeah, that's a great idea.",POSITIVE,12,Being positive,Reinforcing that its a good idea will encourage others to give their ideas,2021-04-09 11:56:54.691348+00:00
1124,ES2007c,1685.89,D,So we're moving in the right direction like,POSITIVE,2,Being positive,"This gives the team encouragement when you say we are moving in the right direction, it encourages forward progress",2021-04-09 11:58:33.801682+00:00
1404,ES2007c,2056.89,C,That sounds good.,POSITIVE,5,Being positive,Being positive about the process they are given helps promote both teamwork and positivity,2021-04-09 11:58:38.183931+00:00
1124,ES2007c,1709.61,A,"<sound: other>, and um I'm not sure about the buttons being in the shape of fruit though.",NEGATIVE,1,Dismissing others,"Be careful about dismissing others ideas, it may cause them to not want to contribute",2021-04-09 11:59:43.711290+00:00
