user_id,dataset,timestamp,speaker,line,direction,agree_cnt,reason,possible_comment,created_at
767,ES2004c,504.416,D,<sound: laugh>,NEGATIVE,2,Dismissing others,Laughing at speaker C's idea does not make this a safe and constructive space,2021-03-31 12:00:41.874015+00:00
767,ES2004c,620.36,A,Mm-hmm.,POSITIVE,1,Being agreeable,Speaker A is showing they are listening and agreeable to the conversation,2021-03-31 12:03:21.062534+00:00
903,ES2004c,1179.73,A,That could be a good idea.,POSITIVE,23,Being positive,D recommend a solution to a problem and A agreed with the solution by stating that it was a good idea. This positive reinforcement will help to encourage D to continue to share ideas/suggestions with the team.,2021-03-31 12:03:45.213525+00:00
767,ES2004c,698.23,B,Like a dual kind of.,POSITIVE,1,Being agreeable,speaker b is showing they are agreeing with what speaker c is presenting by reiterating the conversation,2021-03-31 12:04:37.096973+00:00
903,ES2004c,1174.31,D,"Like a rubber sleeve almost, yeah.",POSITIVE,2,Being agreeable,D is taking B's idea and is expanding on the idea instead of dismissing or ignoring the idea. This positive reinforcement will make B feel like their a part of the team and their ideas are being taken into consideration.,2021-03-31 12:05:40.194305+00:00
767,ES2004c,807.99,B,Can we think about that?,POSITIVE,1,Being respectful,"Speaker B is working to gain the group's consensus without running on their own with an idea, this shows they are willing to listen",2021-03-31 12:06:21.210914+00:00
767,ES2004c,832.63,C,Yeah.,POSITIVE,2,Being agreeable,speaker c is showing they are listening and are in agreement with the ideas speaker B is presenting,2021-03-31 12:07:06.606073+00:00
903,ES2004c,1255.66,A,"Just what you said I I didn't get the uh meaning of it completely, you're saying like",NEGATIVE,6,Causing frusturation,"During the conversation, A stated twice that they did not understand what C was trying to explain. This would cause frustration for C because they would have to keep explaining themselves and would eventually start to discourage them from engaging in the conversation.",2021-03-31 12:11:08.478581+00:00
556,ES2004c,497.99,B,can you explain that?,NEGATIVE,1,Being passive-aggressive,The speaker sounds like they have and aggressive or displeased tone,2021-03-31 14:54:23.402130+00:00
556,ES2004c,531.46,B,That doesn't count though does it?,NEGATIVE,1,Dismissing others,The speaker's tone seems like they are attacking the idea presented by their teammate,2021-03-31 14:54:52.635252+00:00
556,ES2004c,557.01,B,I'm pretty sure that solar is from the sun.,NEGATIVE,3,Being passive-aggressive,The speaker is being sarcastic and kind of annoying at this point. This harms the team,2021-03-31 14:55:22.855801+00:00
556,ES2004c,691.32,D,"I mean, could people put standard batteries in but with a s you know they could leave it in the sunlight for solar charging or the two things not compatible?",POSITIVE,1,Being agreeable,"The speaker is asking about questions about the idea, showing they are paying attention",2021-03-31 14:56:14.468450+00:00
556,ES2004c,769.92,A,"W w which one would last the longest, because we don't want customers to be like you know charging like a mobile phone every day.",POSITIVE,1,Being positive,"The speaker is offering up their own ideas to supplement what was just presented, showing cooperation",2021-03-31 14:57:09.255572+00:00
772,ES2004c,497.99,B,can you explain that?,POSITIVE,4,being involved,By asking for more information you show that you are involved and interested in contributing,2021-03-31 15:30:11.803736+00:00
772,ES2004c,540.83,A,"Regarding those sizes, which one you think will be light because we we have to take into consideration size also, so maybe a standard triple A_ might take lesser space or and dynamo might take more space.",POSITIVE,1,being inclusive,You have asked others their thoughts which shows you value others and want them to contribute,2021-03-31 15:31:17.975686+00:00
772,ES2004c,575.7,A,Right.,POSITIVE,1,Being agreeable,You have shown you are in line with the other participant and have paid attention the their ideas.,2021-03-31 15:32:07.961983+00:00
772,ES2004c,717.74,B,What kind of price are we looking at for I presume the normal batteries are the cheapest?,POSITIVE,1,Being respectful,You have asked for input from others in a respectful way that shows you want to hear what they have to say.,2021-03-31 15:33:53.012830+00:00
772,ES2004c,598.34,C,"I mean the amount the amount of probably moving around you'd be doing all the time would would charge it up, I don't think you'd ever need to actually physically start shaking it up to make it work.",NEGATIVE,1,Dismissing others,It seems another participant was trying to interject and add something but you started speaking.,2021-03-31 15:34:37.493222+00:00
919,ES2004c,799.63,D,"it's not gonna add anything, okay.",NEGATIVE,3,Being passive-aggressive,A bit of a pssive aggressive response to the discussion around power. Not necessary to add the okay at the end there.,2021-03-31 15:39:20.384419+00:00
919,ES2004c,945.64,B,Mm-hmm.,POSITIVE,1,Being agreeable,Passive but agreeable to a long explination. Helps move things forward and reassure the team member they were smart with their analysis,2021-03-31 15:41:09.699117+00:00
919,ES2004c,1181.92,A,It could it would be comfortable to hold on also.,POSITIVE,4,Being positive,Providing benefits of the ideas presented and positives to the design process.,2021-03-31 15:41:58.196728+00:00
919,ES2004c,1259.11,C,"Oh on the on the L_C_D_ screen you could becau you could fit it the problem with it basically is that it's flat and so you can't do lots of curve curved things with it, but um you can you wouldn't have with the L_C_D_ you'd have the wires coming off, you wouldn't have that with the",POSITIVE,3,Reexplaining something,Helpful because when a team member failed to understand something they were not passive aggressive and immediately reexplained the issue,2021-03-31 15:42:40.676131+00:00
919,ES2004c,1328.39,C,Yeah I hadn't I hadn't really thought of that to be honest.,POSITIVE,4,Admitting ignorance.,Helpful to the team moral and everyone's mindset that a member is willing to admit how they failed to think about an option.,2021-03-31 15:47:49.275429+00:00
654,ES2004c,497.99,B,can you explain that?,POSITIVE,4,Being respectful,Asking for help shows vulnerability which makes the other meeting participants more likely to also ask for help if needed.,2021-03-31 17:11:12.104647+00:00
654,ES2004c,551.03,C,Yeah it would the d yeah the dynamo would take more space 'cause you actually need a physical sort of handle to wind up.,POSITIVE,3,Being agreeable,Agreeing with and elaborating on a point someone else made validates their opinions which makes it easier for them to contribute more to the discussion.,2021-03-31 17:13:27.158183+00:00
654,ES2004c,575.14,C,Yeah and most people most people also watch T_V_ in the in the night anyway.,POSITIVE,1,Being positive,Offering complimentary ideas to things others have already said helps promote more constructive dialogue.,2021-03-31 17:14:19.651414+00:00
654,ES2004c,587.25,C,But I I think I think the the next one's the best anyway.,POSITIVE,1,Being positive,"Saying which option they think is the best is going out on a limb and expressing their opinion which helps show their engagement with the topic, prompting others to do the same.",2021-03-31 17:15:18.529646+00:00
654,ES2004c,608.54,A,"And are these like uh what are the life of the kinetic battery, it like it runs for long time?",POSITIVE,1,Being constructive,Asking questions promotes others to answer which helps them feel more engaged in the conversation.,2021-03-31 17:15:57.133042+00:00
190,ES2004c,551.03,C,Yeah it would the d yeah the dynamo would take more space 'cause you actually need a physical sort of handle to wind up.,POSITIVE,3,Being agreeable,The speaker agrees with the previous one on why a dynamo would take up more space.,2021-03-31 17:29:18.110625+00:00
190,ES2004c,587.25,C,But I I think I think the the next one's the best anyway.,NEGATIVE,1,Dismissing others,The speaker dismissed B's point about having the solar charge during the day so it can be charged for the evening.,2021-03-31 17:33:29.315288+00:00
190,ES2004c,532.32,D,Does does light charge as as sunlight does?,NEGATIVE,1,Being sarcastic,The speaker suggests that light does not charge as sunlight does contrary to what the previous speaker alluded to,2021-03-31 17:36:13.972175+00:00
190,ES2004c,506.06,B,"what kind of how l long can you get out of that, I mean can you pick it up and then wind it for two minutes and then that's it for the night?",NEGATIVE,1,Causing frusturation,"The speaker seems to suggest that the battery won't last for long, seemingly challenging the earlier speaker's assertion.",2021-03-31 17:38:19.051157+00:00
190,ES2004c,595.4,B,Yeah I've seen,POSITIVE,1,Being agreeable,This speaker's hardline position seems to thaw as he begins to agree with the speaker.,2021-03-31 17:40:29.173341+00:00
429,ES2004c,872.2,C,"Okay, well I'll move on.",POSITIVE,2,Being positive,Acknowledges what has gone on and then moves forward to be productive,2021-03-31 19:21:12.750407+00:00
429,ES2004c,1024.6,C,the the main problems with the well you could go for wood but I think it would be a bit impractical.,POSITIVE,1,Being respectful,Doesn't agree but does not attack the idea merely points out his reasoning,2021-03-31 19:22:23.290843+00:00
429,ES2004c,1188.72,B,Well that's been really popular with mobile phones so I don't see why not.,POSITIVE,5,Being positive,Noting the good about the idea and expanding on it a bit,2021-03-31 19:24:10.803560+00:00
429,ES2004c,1195.06,B,'Kay.,POSITIVE,1,Being agreeable,Indicating agreement to go on with the discussion and signalling engagement,2021-03-31 19:24:43.730007+00:00
429,ES2004c,1250.61,A,"Sorry I didn't get the last part, you're talking of",POSITIVE,11,Being respectful,Doesn't understand so very politely indicates the problem is his not the presenter's,2021-03-31 19:25:46.295910+00:00
270,ES2004c,868.04,D,But it's something to put on the side to think about maybe.,NEGATIVE,3,Dismissing others,"This seems to be a little to dismissive, especially with the word ""maybe"" on the end of it. 'Maybe we will look at your idea, maybe we won't' wouldn't be encouraging for other to put their ideas forward.",2021-04-01 10:47:15.110709+00:00
958,ES2004c,872.2,C,"Okay, well I'll move on.",NEGATIVE,1,Dismissing others,They suggested moving on to the next topic without fully acknowledging the idea that was given. This makes them feel silly for even suggesting it,2021-04-01 10:47:41.007187+00:00
785,ES2004c,812.31,D,"Shouldn't we do some market research on that first before we add it in because I I personally right, okay.",POSITIVE,3,Being respectful,"rather than dictating, asking a question to the team if a certain task should be done.",2021-04-01 10:48:08.520374+00:00
958,ES2004c,816.29,B,Well add it in to think about um,POSITIVE,1,Being respectful,Acknowledges what was said and then says they will consider it. Shows they are listening and appreciating the ideas given.,2021-04-01 10:48:41.852368+00:00
958,ES2004c,873.37,B,Mm-hmm.,POSITIVE,1,Being respectful,This person shows they are listening to what is being said. They are being an active engaged listener,2021-04-01 10:49:35.676905+00:00
958,ES2004c,1123.63,A,"So is that feature available in like uh titanium, or it's like only specific to plastic or",POSITIVE,2,Being respectful,Engaging with the speaker and asking relevant questions. Shows they are listening to their ideas and valuing their feedback.,2021-04-01 10:50:48.058789+00:00
785,ES2004c,868.04,D,But it's something to put on the side to think about maybe.,POSITIVE,4,Being respectful,"In the previous sentence, this person dismissed an argument. But with this comment, he agrees that this is important, but not within the scope of this project.",2021-04-01 10:51:22.537936+00:00
958,ES2004c,1154.44,D,I've got a mobile phone myself which is titanium and it does mark very easily if you drop it.,POSITIVE,1,Being agreeable,"Gives their own example from their life to reinforce what the speaker is saying, and to engage further with them. Being an active and engaged participant in the conversation, shows they care about what is being said.",2021-04-01 10:51:37.312151+00:00
785,ES2004c,857.15,D,"It's not something that's come up in any of our uh focus groups and market research, it's not a thing that people are looking for",NEGATIVE,4,Dismissing others,dismissing an argument. It could be that this person does not want this meeting derailed with out of scope items.,2021-04-01 10:52:04.838198+00:00
767,ES2004c,832.63,C,Yeah.,POSITIVE,2,Being agreeable,"Agreeing with what speaker B is presenting, encouraging them to continue cultivates a supportive atmosphere.",2021-04-01 10:52:55.291970+00:00
785,ES2004c,918.16,B,What kind of things do we have to consider there?,POSITIVE,2,Being positive,"Asking questions to better understand the other ideas. This person does not grasp the idea fully, and asking questions is a  good way to show others that you really want to understand their idea.",2021-04-01 10:54:05.189476+00:00
767,ES2004c,857.15,D,"It's not something that's come up in any of our uh focus groups and market research, it's not a thing that people are looking for",NEGATIVE,4,Dismissing others,disagreeing with the speaker and pretty much letting them know its a bad idea can derail the entire meeting and make the speaker feel like they had a bad idea.,2021-04-01 10:54:11.761586+00:00
767,ES2004c,1179.73,A,That could be a good idea.,POSITIVE,23,Being positive,"The group collaborated on an idea, giving this immediate feedback makes the other speakers know they're being heard.",2021-04-01 10:56:25.529615+00:00
785,ES2004c,1117.63,A,"So in this case if you're looking at like a customer can change the colour like from green, parrot green to chilli red or something like that.",NEGATIVE,1,Causing annoyance,"I think this is an unnecessary question, and sounds like the person is causing annoyance.",2021-04-01 10:56:58.235978+00:00
767,ES2004c,1295.95,D,Have I misunderstood you?,POSITIVE,5,Being respectful,"gaining clarification so the group is on the same page is helpful in keeping an open, honest communication.",2021-04-01 10:57:49.651002+00:00
767,ES2004c,868.04,D,But it's something to put on the side to think about maybe.,NEGATIVE,3,Dismissing others,"after speaker d shut down the idea, they then said ""maybe later"" although it doesn't seem like they meant it.",2021-04-01 11:01:22.471788+00:00
9,ES2004c,812.31,D,"Shouldn't we do some market research on that first before we add it in because I I personally right, okay.",NEGATIVE,3,Causing annoyance,Talks about researching an idea without giving any information on where to research or why it is important to..,2021-04-01 11:59:20.599776+00:00
9,ES2004c,825.09,B,"If it is the kinetic thing and it is small and it is portable and it is a different shape and the kinetic is something people don't do kind of we're doing something original and different um but if you wore it if it's something you could just clip on your pocket then you would have that less, you you wouldn't lose it so much.",POSITIVE,1,Being respectful,Giving details on idea so that the other group members are all on the same page.,2021-04-01 11:59:45.735434+00:00
9,ES2004c,874.85,C,"Um, my second part of my findings uh the mo most current remotes use this silicone uh P_C_B_ board which pr printed circuit board, which basically has these contacts that are really close together and then when you press down on the rubber button, it'll connect the circuit and each each switch is connected to two uh different legs on the chip and so sends a different message and that then uh gets translated by the chip into a code and then it's fired out of this L_E_D_ in the sequence of l on and off bursts.",POSITIVE,1,Being respectful,Gives good information and details and explains concept well to other group members.,2021-04-01 12:00:07.279869+00:00
9,ES2004c,1111.24,A,"Second thing is yeah and second question is like, a mobile you can change the cover, you call it a skin or whatever.",POSITIVE,3,Being positive,Brings up good idea on being able to change the skin of the phone.,2021-04-01 12:00:45.524628+00:00
9,ES2004c,1169.94,B,"So instead of the fascia that comes off being plastic, the fascia that comes off would be the rubber, like those pens that you get with the grip, that you can you can pull that off.",POSITIVE,1,Being agreeable,"Continues the idea of the other group member and adds input. Shows that they not only agree, but have more to add to the idea.",2021-04-01 12:01:22.601577+00:00
770,ES2004c,1522.92,A,And uh second thing is there's too much of confusion here.,NEGATIVE,2,Causing frusturation,This like just will cause frustration among the group based on the way it is phrased. The speaker could've phrased it in a more positive manner.,2021-04-01 12:57:52.787922+00:00
770,ES2004c,1846.62,C,I think that would be quite fun.,POSITIVE,15,Being positive,This will help push everyone to getting to a decision and make them think their idea is sound.,2021-04-01 12:59:18.316675+00:00
770,ES2004c,2082.3,D,"I'm just kind of pushing at that to see if you came out with anything else, but I mean I totally agree.",NEGATIVE,2,Causing annoyance,They seem to be purposely pushing the buttons on the other speakers rather than just straight up ask a question. They could've been much more direct about it but choose to go subtle.,2021-04-01 13:00:40.158933+00:00
770,ES2004c,2321.72,A,I think we are pretty going in a clear direction now.,POSITIVE,8,Being positive,This will definitely help the others finish the conversation without any trouble.,2021-04-01 13:02:17.886686+00:00
770,ES2004c,2190.95,D,"Yes, it was just, there was just a cost issue with that, but it's a good idea we just need to check on the cost, is that right?",POSITIVE,5,Being positive,Yet another example of more positive reinforcement. They are getting close to a decision so this statement is perfect.,2021-04-01 13:03:42.996351+00:00
772,ES2004c,812.31,D,"Shouldn't we do some market research on that first before we add it in because I I personally right, okay.",POSITIVE,3,Being respectful,Using the work we lets others know you consider the group a team and you are asking for input from others.,2021-04-01 14:44:21.768121+00:00
772,ES2004c,823.7,B,where am I?,NEGATIVE,1,Causing annoyance,Losing your place may show you are unprepared and not respectful of others.,2021-04-01 14:45:05.256072+00:00
772,ES2004c,849.84,C,Yeah.,POSITIVE,1,Being positive,You have shown an acknowledgment of what the last participant said showing you pay attention and find others valuable.,2021-04-01 14:46:22.080922+00:00
772,ES2004c,857.15,D,"It's not something that's come up in any of our uh focus groups and market research, it's not a thing that people are looking for",NEGATIVE,4,Dismissing others,You have been dismissing of another persons idea which makes participants uncomfortable.,2021-04-01 14:47:00.150054+00:00
772,ES2004c,868.04,D,But it's something to put on the side to think about maybe.,POSITIVE,4,Being respectful,You have shown respect of another persons idea which makes others feel comfortable sharing.,2021-04-01 14:47:57.897813+00:00
556,ES2004c,812.31,D,"Shouldn't we do some market research on that first before we add it in because I I personally right, okay.",NEGATIVE,3,Being passive-aggressive,"The speaker is suggesting a different course of action, which means they disagree with what is happening",2021-04-01 15:11:08.646280+00:00
556,ES2004c,854.12,B,the eternal battle for control of the controls.,POSITIVE,3,Being positive,"The speaker is making a joke, which is making the team laugh and lighten the mood",2021-04-01 15:11:32.604107+00:00
556,ES2004c,1179.73,A,That could be a good idea.,POSITIVE,23,Being agreeable,"The speaker is praising what his team mate is presenting, giving them some confidence.",2021-04-01 15:12:41.870827+00:00
556,ES2004c,1250.61,A,"Sorry I didn't get the last part, you're talking of",NEGATIVE,5,Causing frusturation,The speaker may not have been paying attention to what their team member was talking about,2021-04-01 15:13:10.659867+00:00
556,ES2004c,1285.14,D,"I don't s sorry to interrupt, I don't see why the curved thing is a problem, if we for example had a shell, once we open that yeah, so it'd be f yeah, yeah.",NEGATIVE,3,Causing frusturation,"The spekaer is interrupting the presentation to throw in his two cents, which may be frustrating.",2021-04-01 15:13:37.439176+00:00
556,ES2004c,347.85,D,"So a lot of interesting feedback there, both from our market research departments and from our people in Paris and Milan.",POSITIVE,4,Being positive,"The speaker is praising the feedback the team got on their design, showing that he is cooperative.",2021-04-01 15:17:24.330570+00:00
556,ES2004c,363.56,A,Fine.,NEGATIVE,1,Being passive-aggressive,I always feel that using this word in this manner is kind of sarcastic and you always come off as frustrated or mad.,2021-04-01 15:17:52.856734+00:00
556,ES2004c,388.56,B,I hate those little things,NEGATIVE,4,Causing annoyance,the speaker is being overly negative and aggressive about something is considered a very minor issue in my eyes,2021-04-01 15:18:26.741225+00:00
556,ES2004c,502.19,C,So you wind up your remote control before you use it.,POSITIVE,1,Being positive,"the speaker is making a joke, lightening the mood of the meeting",2021-04-01 15:19:12.836512+00:00
556,ES2004c,557.01,B,I'm pretty sure that solar is from the sun.,NEGATIVE,3,Being sarcastic,"the speaker is being sarcastic, which some people may find kind of annoying.",2021-04-01 15:19:42.976262+00:00
654,ES2004c,854.12,B,the eternal battle for control of the controls.,POSITIVE,3,Being positive,Making a joke lightens the mood and boosts morale in a meeting.,2021-04-01 17:49:22.875797+00:00
654,ES2004c,855.968,C,<sound: laugh>,POSITIVE,1,Being positive,Laughing at a joke someone made validates it and make them feel better for it.,2021-04-01 17:49:40.334245+00:00
654,ES2004c,857.15,D,"It's not something that's come up in any of our uh focus groups and market research, it's not a thing that people are looking for",NEGATIVE,4,Dismissing others,They're dismissing something someone else mentioned by saying it has nothing to do with what they're looking for.,2021-04-01 17:50:08.651271+00:00
654,ES2004c,868.04,D,But it's something to put on the side to think about maybe.,NEGATIVE,3,Dismissing others,They're saying it's something they might or might not get back to which is dismissive of their ideas.,2021-04-01 17:50:50.128549+00:00
654,ES2004c,872.2,C,"Okay, well I'll move on.",POSITIVE,2,Being positive,Deciding to move on and getting on with the project is a positive thing to do.,2021-04-01 17:51:19.443851+00:00
540,ES2004c,918.16,B,What kind of things do we have to consider there?,POSITIVE,2,Being respectful,"They are responding to a previous comment while demonstrating they have been listening attentively, so by asking a question it both adds a positive element to the discussion and invites others to share their thoughts in return.",2021-04-01 19:12:44.089099+00:00
540,ES2004c,868.04,D,But it's something to put on the side to think about maybe.,POSITIVE,4,Being respectful,This person is respectfully offering an opposite opinion in regards to whether a feature would be appealing without being dismissive or mean about it so I feel this encourages a positive chatting environment.,2021-04-01 19:13:36.242798+00:00
540,ES2004c,812.31,D,"Shouldn't we do some market research on that first before we add it in because I I personally right, okay.",POSITIVE,3,Being respectful,I believe this person is making a reasonable statement in response to an element being added to the project but it could be easily interpreted the opposite depending on the person. I think their intent is to ensure they consider the cost associated with it or that there is a demand for such a feature rather than to be purely negative but I could be mistaken.,2021-04-01 19:21:33.334174+00:00
540,ES2004c,857.15,D,"It's not something that's come up in any of our uh focus groups and market research, it's not a thing that people are looking for",POSITIVE,1,Being respectful,"Just because this person does not agree, I do think they are being fairly reasonable in offering a contrasting opinion. I do think they could word themselves better, certainly, but the intent doesn't seem to be to harm someone else's desire to speak or contribute.",2021-04-01 19:23:24.118399+00:00
540,ES2004c,1117.63,A,"So in this case if you're looking at like a customer can change the colour like from green, parrot green to chilli red or something like that.",POSITIVE,3,Being positive,This person seems to have actively listened to the ideas of a design element while offering their understanding so that makes the other person feel heard. This tends to create a positive environment while chatting.,2021-04-01 19:25:22.079926+00:00
540,ES2004c,919.88,B,"Can we what kind of size, does it come in varying sizes or is it just one size and we would have to fit the design of",POSITIVE,1,Being respectful,They are asking another question while thinking out loud which feels welcoming for others to respond in kind and offer their feedback or their own ideas on the matter.,2021-04-01 19:27:14.118180+00:00
