user_id,dataset,timestamp,speaker,line,direction,agree_cnt,reason,possible_comment,created_at
534,ES2008b,490.26,A,That was that was great.,POSITIVE,19,Being positive,The selected line reinforced the psychological safety by being positive.,2021-04-06 13:32:04.306570+00:00
112,ES2008b,1685.73,B,"Yeah, that's a good idea.",POSITIVE,13,Being positive,They are telling the person they are valued and have good ideas which encourages speaking up,2021-04-06 13:33:53.718547+00:00
112,ES2008b,1696.69,B,Good point.,POSITIVE,8,Being positive,They gave a compliment which gives support to the conversation.,2021-04-06 13:34:30.324619+00:00
534,ES2008b,1204.58,A,"Yes, absolutely.",POSITIVE,7,Being respectful,The selected line reinforced the psychological safety by being respectful.,2021-04-06 13:36:46.291544+00:00
9,ES2008b,490.26,A,That was that was great.,POSITIVE,19,Being agreeable,Complimenting previous group member for their presentation on the information they had to cover.,2021-04-06 14:00:59.142522+00:00
9,ES2008b,524.79,D,"And I think that's in the shared, if I did it right, if anyone wants to look at it.",POSITIVE,2,Being respectful,Letting group know where to find the information in case they need to see it.,2021-04-06 14:01:32.073338+00:00
9,ES2008b,849.33,A,That was very useful.,POSITIVE,12,Being respectful,Letting group member know that all of the information they presented was useful to them.,2021-04-06 14:02:09.861360+00:00
9,ES2008b,895.62,C,"Uh that was just on the d on the company web site, yeah.",POSITIVE,1,Being respectful,Helping group member who was having trouble getting to the right page.,2021-04-06 14:03:00.222239+00:00
9,ES2008b,911.92,A,There are three thingy if it's way at the bottom.,POSITIVE,1,Being respectful,Being supportive and helping group member use a tool that they are having problems with.,2021-04-06 14:03:27.720424+00:00
1205,ES2008b,489.6,A,Thank you very much.,POSITIVE,8,Being respectful,This speaker is thanking the other speaker and doing so respectfully,2021-04-06 15:23:00.277264+00:00
1205,ES2008b,490.26,A,That was that was great.,POSITIVE,19,Being positive,This speaker is positively reinforcing what the previous speaker said.,2021-04-06 15:23:30.678524+00:00
1205,ES2008b,528.2,A,"Mm 'kay, thank you.",POSITIVE,5,Being polite,This speaker is thanking the other one in a polite manner.,2021-04-06 15:26:36.888946+00:00
1205,ES2008b,528.25,B,"Okay, great.",POSITIVE,4,Being positive,This speaker is acknowledging and thanking Speaker D for making the presentation available.,2021-04-06 15:28:52.277528+00:00
1205,ES2008b,501.87,D,"Yeah, have I unscrewed it?",POSITIVE,1,Feeling safe,"This speaker feels safe in this environment so that they can ask if they have done something right, without a feeling that they will be ridiculed.",2021-04-06 15:30:25.230421+00:00
1106,ES2008b,490.26,A,That was that was great.,POSITIVE,19,Being positive,Provides a compliment to boost the other's self esteem and confidence,2021-04-06 16:32:46.053719+00:00
1106,ES2008b,489.6,A,Thank you very much.,POSITIVE,8,Being respectful,It is always nice to receive appreciation for something you said or did.,2021-04-06 16:33:12.985950+00:00
1106,ES2008b,849.33,A,That was very useful.,POSITIVE,12,Being positive,Explaining that the other's long explaination was useful information for everyone to hear,2021-04-06 16:34:16.323951+00:00
1106,ES2008b,1098.85,A,Pardon.,POSITIVE,4,Being respectful,Excusing yourself for a sneeze or cough is a polite thing to do and is respectful,2021-04-06 16:35:24.772589+00:00
1106,ES2008b,1114.57,B,Don't show me that tip again.,NEGATIVE,10,Causing frusturation,Showing negativity and frustration with the other participant can cause frustration for everyone,2021-04-06 16:38:00.773082+00:00
540,ES2008b,489.6,A,Thank you very much.,POSITIVE,8,Being positive,An offering of gratitude is generally appreciated by others in a group discussion so this adds positivity to the chat.,2021-04-06 16:59:24.937713+00:00
540,ES2008b,490.26,A,That was that was great.,POSITIVE,19,Being positive,This is a statement of praise which raises group morale as a whole because people feel valued for their contributions.,2021-04-06 16:59:51.770208+00:00
540,ES2008b,518.07,C,Cheers.,POSITIVE,3,Being positive,This is a positive affirmation that creates a welcoming environment for sharing thoughts.,2021-04-06 17:00:52.221111+00:00
540,ES2008b,528.2,A,"Mm 'kay, thank you.",POSITIVE,5,Being respectful,"By giving thanks to another person, it shows them that their actions or thoughts are valued which creates a healthy interactive group dynamic.",2021-04-06 17:01:45.283981+00:00
540,ES2008b,528.25,B,"Okay, great.",POSITIVE,4,Being agreeable,This person is adding further positive confirmation that they are following along with the discussion and appreciate the efforts given which is helpful for a team chat.,2021-04-06 17:02:41.838243+00:00
540,ES2008b,754.087,A,<sound: laugh>,NEGATIVE,3,Causing annoyance,The laughter here is a bit out of context as the person speaking previously was not making a joke but rather giving a detailed explanation.,2021-04-06 17:04:00.053236+00:00
540,ES2008b,755.523,B,<sound: laugh>,NEGATIVE,1,Causing embarrassment,This person is laughing out of context with what is being said which can detract from the person who is offering their ideas and cause them to feel embarrassment.,2021-04-06 17:04:32.633941+00:00
540,ES2008b,848.51,A,Thank you very much.,POSITIVE,3,Being agreeable,"Telling someone ""thank you"" is an amiable and helpful way to make them feel valued for their contributions.",2021-04-06 17:05:16.460193+00:00
540,ES2008b,849.33,A,That was very useful.,POSITIVE,12,Being respectful,This comment gives someone insight into why their idea was valuable as well as shows respect to them for their efforts.,2021-04-06 17:05:40.150051+00:00
540,ES2008b,861.05,B,I think that could be our selling point.,POSITIVE,1,Being respectful,This is a positive reaction to the group task as they notice existing designs are not very well made so this helps give a guiding pathway towards new ideas to be shared among the group.,2021-04-06 17:06:38.090896+00:00
571,ES2008b,490.26,A,That was that was great.,POSITIVE,19,Being respectful,They were telling the other person that what they were saying was great.,2021-04-06 19:56:26.505934+00:00
571,ES2008b,849.33,A,That was very useful.,POSITIVE,12,Being positive,They are telling the other person that their speech was useful,2021-04-06 19:57:06.493823+00:00
571,ES2008b,909.18,A,Um the it's right above Draw.,POSITIVE,1,Being respectful,They are helping the other person learn how to use the program,2021-04-06 19:57:53.193855+00:00
571,ES2008b,1097.07,B,"Sorry about that, guys.",POSITIVE,12,Being respectful,They were struggling for a moment so they apologized to the team.,2021-04-06 19:58:26.183869+00:00
571,ES2008b,1181.11,A,Excellent.,POSITIVE,12,Being positive,They are telling the person that they enjoyed their speech.,2021-04-06 19:58:48.646914+00:00
831,ES2008b,716.18,A,Hmm.,POSITIVE,1,Being respectful,Shows that the participate is actively listening during a long explanation,2021-04-06 22:41:58.475169+00:00
831,ES2008b,1009.92,A,That'll be fine.,POSITIVE,3,Being positive,A is reassuring B when there are technical difficulties during his presentation,2021-04-06 22:44:48.948273+00:00
831,ES2008b,1220.68,A,"Lefty loosey, righty tighty, right?",POSITIVE,1,Being positive,Speaker A is making a joke and trying to loosen the mood after the technical difficulties,2021-04-06 22:47:06.044705+00:00
831,ES2008b,1436.67,D,Mm-hmm.,POSITIVE,2,Being respectful,D is displaying active listening by reaffirming to the speaker before that he is paying attention,2021-04-06 22:50:59.765485+00:00
113,ES2008b,489.6,A,Thank you very much.,POSITIVE,8,Being respectful,This is a very strong statement of gratitude. Gratitude is important in group work so members feel valued.,2021-04-06 22:54:41.923951+00:00
831,ES2008b,1685.73,B,"Yeah, that's a good idea.",POSITIVE,13,Being agreeable,SPeaker A is reinforcing the idea presented by Speaker D previously,2021-04-06 22:55:23.047040+00:00
113,ES2008b,490.26,A,That was that was great.,POSITIVE,19,Being positive,This is a complementary statement. Compliments with strong positive wording inspire self confidence.,2021-04-06 22:55:36.754853+00:00
113,ES2008b,528.2,A,"Mm 'kay, thank you.",POSITIVE,5,Being respectful,"This is another statement of gratitude, along with an agreement statement before it.",2021-04-06 22:56:15.302281+00:00
113,ES2008b,528.25,B,"Okay, great.",POSITIVE,4,Being positive,This uses a strong complimentary word (great) and okay is used to show understanding and validation.,2021-04-06 22:57:13.058903+00:00
188,ES2008b,490.26,A,That was that was great.,POSITIVE,19,Being positive,A's line shows appreciation and support for the presentation that was just given to make sure the presenter feels appreciated and that their presentation was valued.,2021-04-06 22:57:57.392156+00:00
113,ES2008b,849.33,A,That was very useful.,POSITIVE,12,Being positive,"Not only was this statement complimentary, but it explained why the compliment was deserved.",2021-04-06 22:58:10.862297+00:00
188,ES2008b,849.33,A,That was very useful.,POSITIVE,12,Being positive,A shows appreciation for the presentation and makes sure the presenter knows that he/she values their input.,2021-04-06 22:59:39.017689+00:00
831,ES2008b,2142.36,B,"Yeah, who knows.",NEGATIVE,2,Being sarcastic,SPeaker B is being sarcastic about others abilities to be able to work the website/meeting video room,2021-04-06 23:00:33.360748+00:00
188,ES2008b,865.53,B,Right.,POSITIVE,1,Being agreeable,B is voicing his/her agreement with C and showing his/her support.,2021-04-06 23:00:55.969533+00:00
188,ES2008b,892.25,A,Lovely.,POSITIVE,2,Being positive,A is keeping an upbeat and positive attitude even when multiple people are having technical difficulties presenting during the meeting.,2021-04-06 23:01:39.612377+00:00
188,ES2008b,1181.11,A,Excellent.,POSITIVE,12,Being positive,"A is showing positivity, appreciation, and how he/she values the presentation of the working design that B just gave.",2021-04-06 23:02:48.061049+00:00
897,ES2008b,1118.67,B,I'm kind of pathetic with things like this.,NEGATIVE,10,Being sarcastic,"B is using some self deprecation humor here, which is also sarcasm",2021-04-07 12:51:24.244704+00:00
897,ES2008b,1114.57,B,Don't show me that tip again.,NEGATIVE,10,Being sarcastic,B is being very sarcastic here by telling the remote to not do something again. i.e. talking to inanimate objects,2021-04-07 12:52:08.890314+00:00
897,ES2008b,1215.77,A,Ah I can never tell which way to turn these things.,NEGATIVE,1,Causing embarrassment,A is embarrassed by not being able to figure out how to loosen something,2021-04-07 12:52:57.956933+00:00
897,ES2008b,1346.56,B,"I have no idea why we don't have it, but",NEGATIVE,1,Being passive-aggressive,B is being very passive aggressive when asking why the US doesn't have something,2021-04-07 12:54:34.568355+00:00
897,ES2008b,1796.88,C,"It's for, like, the ultimately lazy people, who can't even be bothered to pick up the remote.",NEGATIVE,6,Being passive-aggressive,C is calling people who don't pick up a remote lazy,2021-04-07 12:56:55.284806+00:00
897,ES2008b,2142.73,A,"It's kinda frustrating, but um",NEGATIVE,1,Causing annoyance,A is frustrated the site didn't work and is venting that frustration to the group,2021-04-07 12:58:54.745855+00:00
1171,ES2008b,1000.2,B,And then I think the easiest thing to do is gonna be work on each task separately.,POSITIVE,2,Being respectful,Showing respect for the team and explaining how each member will have a task.,2021-04-07 13:12:05.299981+00:00
1171,ES2008b,1097.07,B,"Sorry about that, guys.",POSITIVE,12,Being respectful,This line apologizes for a mistake that was made and shows respect.,2021-04-07 13:12:55.732321+00:00
1171,ES2008b,1098.85,A,Pardon.,POSITIVE,4,Being respectful,This line respectfully interrupts the conversation for the team to listen.,2021-04-07 13:13:24.422070+00:00
1171,ES2008b,1102.54,B,"Okay, let's just get back to my schematic here.",NEGATIVE,2,Being passive-aggressive,This line is sort of demanding and not very respectful of others.,2021-04-07 13:13:49.145756+00:00
1171,ES2008b,1114.57,B,Don't show me that tip again.,NEGATIVE,10,Dismissing others,This line is very disrepectful for the other team member that wanted to show them a tip.,2021-04-07 13:14:11.928897+00:00
1205,ES2008b,966.76,B,"Don't know if I'm explaining that very well, but how do I get to the next s ah.",POSITIVE,1,Feeling safe,Speaker B feels safe enough to express doubt on whether they are explaining correctly. They are not afraid to make a mistake.,2021-04-07 14:07:33.745679+00:00
1205,ES2008b,1008.42,A,"You just press yeah, just click.",POSITIVE,1,Being helpful,Speaker A is offering guidance to Speaker B in a non-judgmental way.,2021-04-07 14:09:07.741216+00:00
1205,ES2008b,1009.92,A,That'll be fine.,POSITIVE,3,Being positive,Speaker A is reinforcing Speaker B's actions in a positive manner.,2021-04-07 14:10:02.416531+00:00
1205,ES2008b,1010.66,B,So the findings that I got uh very just very briefly is that you have a choice of the way that the information is projected to the receiver and in my opinion infra-red is the best way to do that 'cause you don't need a sight line.,POSITIVE,2,Feeling safe,Speaker B is not afraid to offer their opinion in this group. Speaker B shows that they feel safe in this group.,2021-04-07 14:11:31.166485+00:00
556,ES2008b,966.76,B,"Don't know if I'm explaining that very well, but how do I get to the next s ah.",NEGATIVE,1,Causing annoyance,"The speaker is down on himself, which makes him sound unconfident, which may harm the group",2021-04-07 14:12:33.827801+00:00
556,ES2008b,1009.92,A,That'll be fine.,POSITIVE,3,Being positive,The speaker is okay with what his teammate is suggesting,2021-04-07 14:12:53.686836+00:00
556,ES2008b,1097.07,B,"Sorry about that, guys.",POSITIVE,12,Being respectful,"the speaker is apologizing to the team, showing that he respects them",2021-04-07 14:13:20.477461+00:00
556,ES2008b,1117.51,B,"Sorry about this, guys.",POSITIVE,9,Being respectful,"The speaker is apologizing to the team, showing that he respects them",2021-04-07 14:13:45.992531+00:00
556,ES2008b,1181.11,A,Excellent.,POSITIVE,12,Being positive,The speaker is praising what his teammate has just finished presenting.,2021-04-07 14:14:04.865031+00:00
1205,ES2008b,1000.2,B,And then I think the easiest thing to do is gonna be work on each task separately.,POSITIVE,2,Feeling safe,Speaker B feels they are in a safe environment. They are not afraid to offer their opinion on how to proceed.,2021-04-07 14:15:13.531682+00:00
370,ES2008b,1010.66,B,So the findings that I got uh very just very briefly is that you have a choice of the way that the information is projected to the receiver and in my opinion infra-red is the best way to do that 'cause you don't need a sight line.,POSITIVE,2,Being agreeable,Providing thoughtful and thorough suggestions at the beginning of the meeting helps get everone on track and focused.,2021-04-07 14:26:14.525168+00:00
874,ES2008b,1097.07,B,"Sorry about that, guys.",POSITIVE,12,Being respectful,This person acknowledges that they were slowing the team down and is expressing responsibility and sorry for that.,2021-04-07 14:56:19.236505+00:00
874,ES2008b,1117.51,B,"Sorry about this, guys.",POSITIVE,9,Being respectful,This person is being respectful by apologizing for the inconvenience.,2021-04-07 14:57:08.448286+00:00
874,ES2008b,1118.67,B,I'm kind of pathetic with things like this.,NEGATIVE,10,Dismissing others,Calling oneself pathetic is negative and inappropriate for the conversation.,2021-04-07 14:57:38.658742+00:00
874,ES2008b,1181.11,A,Excellent.,POSITIVE,12,Being positive,This is a great way of being positive. This member is expressing praise.,2021-04-07 14:59:08.781813+00:00
874,ES2008b,1204.58,A,"Yes, absolutely.",POSITIVE,7,Being agreeable,Here this member is agreeing to help one of the other members.,2021-04-07 14:59:56.903349+00:00
370,ES2008b,1102.54,B,"Okay, let's just get back to my schematic here.",POSITIVE,2,Being respectful,Making a comment to get the group back on track after a distraction keeps everone focused.,2021-04-07 15:01:02.998947+00:00
370,ES2008b,1292.05,B,"Uh, it's a British thing.",NEGATIVE,1,Dismissing others,Answering a question from a team member in a passive manner can make them feel left out of the conversation.,2021-04-07 15:04:21.708086+00:00
370,ES2008b,1586.08,B,Well but why are we why are we aiming for a technological advancement?,NEGATIVE,1,Being sarcastic,Making a sarcastic comment when discussing the best features can throw the group dynamic off.,2021-04-07 15:26:12.751793+00:00
370,ES2008b,1796.88,C,"It's for, like, the ultimately lazy people, who can't even be bothered to pick up the remote.",NEGATIVE,6,Causing frusturation,Putting down another group members suggestion could cause resentment between members.,2021-04-07 15:29:42.768626+00:00
823,ES2008b,1118.67,B,I'm kind of pathetic with things like this.,NEGATIVE,10,Causing frusturation,"This presentation is frustrating to other users because lines like this make others feel uncomfortable and frustrated. They feel awkward and out of place, which may harm their confidence in the group and even themselves.",2021-04-07 16:53:15.911863+00:00
823,ES2008b,1115.89,A,There we are.,POSITIVE,1,Being positive,"This sort of message is good because it provides encouragement and positive feedback to presenter as things go wrong, which makes them feel confident enough to continue.",2021-04-07 16:54:04.300202+00:00
823,ES2008b,1107.22,A,Double click on it.,POSITIVE,2,Being respectful,"It is respectful to help a presenter like this. If nobody helps them during an embarrassing moment, the presenter, as well as the others in the room, may be less likely to present properly in the future and may feel inadequate.",2021-04-07 16:54:37.875796+00:00
823,ES2008b,1181.11,A,Excellent.,POSITIVE,12,Being positive,"Such positive feedback, especially after an uncomfortable moment, helps cut the edge off any negative emotions the presenter is experiencing. They will be more likely to remain confident and included for future meetings.",2021-04-07 16:55:19.025953+00:00
823,ES2008b,1289.92,D,What's teletext?,POSITIVE,1,Being honest,"This comment is great. Seeking clarification in a meeting helps ""break the ice"" and makes others comfortable enough to speak up. Confidence and freedom of expression is huge when it comes to psychological safety.",2021-04-07 16:57:28.384324+00:00
1289,ES2008b,1181.11,A,Excellent.,POSITIVE,12,Being positive,Another speaker just gave a long explanation and this comment gives them positive re-enforcement,2021-04-07 18:27:04.345857+00:00
1289,ES2008b,1204.58,A,"Yes, absolutely.",POSITIVE,7,Being agreeable,You are showing that you are more than willing to be helpful,2021-04-07 18:27:35.974962+00:00
1289,ES2008b,1596.27,A,That's a good thing to keep in mind.,POSITIVE,13,Being positive,This comment is giving positive re-enforcement to another person's idea,2021-04-07 18:30:35.091935+00:00
1289,ES2008b,1685.73,B,"Yeah, that's a good idea.",POSITIVE,13,Being positive,By agreeing with the other speaker and saying they have a good idea you are giving them positive feedback.,2021-04-07 18:33:03.730435+00:00
1289,ES2008b,1696.69,B,Good point.,POSITIVE,8,Being positive,You are giving positive feedback to someone who just stated an idea.,2021-04-07 18:33:30.720309+00:00
1289,ES2008b,1714.8,A,"Okay, those are very good goals, I think, um that we have to keep in mind in with everything we do.",POSITIVE,9,Being agreeable,"You are saying to others that they came up with a good idea, which is positive",2021-04-07 18:34:48.798764+00:00
1289,ES2008b,1885.3,B,That's a good point.,POSITIVE,10,Being positive,By saying that the other person made a good point you are giving them positive feedback,2021-04-07 18:36:44.876923+00:00
1289,ES2008b,2147.09,A,Be sure to note any frustrations or any um issues that come up in your um in your um summary.,POSITIVE,4,encouraging communication,By telling the others to note down frustrations you are showing that you take their views seriously,2021-04-07 18:39:27.276793+00:00
1289,ES2008b,2160.71,A,Great seeing y'all.,POSITIVE,5,Being positive,This comment will make the others feel good about the meeting.,2021-04-07 18:39:57.567111+00:00
363,ES2008b,1114.57,B,Don't show me that tip again.,NEGATIVE,10,Being passive-aggressive,The user may be speaking outloud to themselves but they are being passive aggressive or in the very least bringing a frustrated energy to the group.,2021-04-08 10:27:15.377717+00:00
363,ES2008b,1117.51,B,"Sorry about this, guys.",POSITIVE,9,Being respectful,This speaker is prefacing his statements by apologizing for the delay and this is a sign of respect for the group.,2021-04-08 10:27:40.043518+00:00
363,ES2008b,1118.67,B,I'm kind of pathetic with things like this.,NEGATIVE,10,Self abuse,"This speaker is putting themselves down in a negative way by calling themselves pathetic in front of the group, this is a negative energy to be displaying even if its mocking one's own self.",2021-04-08 10:28:47.225553+00:00
363,ES2008b,1138.01,B,So hopefully that makes sense for everyone in my kind of garbled way.,NEGATIVE,3,Dismissing others,"By saying ""hopefully that makes sense for everyone"" the speaker is sort of being passive aggressive and acting as though they aren't smart enough to keep up.",2021-04-08 10:29:30.797584+00:00
363,ES2008b,1148.72,B,"personal preferences, besides the fact that I can't spell, we need a long-lasting energy source, people don't wanna be changing it a lot.",NEGATIVE,2,Self absue,This speaker is continuing a pattern of abusive statements toward themselves which is harmful to themselves and group as a whole.,2021-04-08 10:30:06.868938+00:00
556,ES2008b,1097.07,B,"Sorry about that, guys.",POSITIVE,12,Being respectful,"The speaker is apologizing to the team, showing that he has some respect for them",2021-04-08 13:02:45.945207+00:00
556,ES2008b,1114.57,B,Don't show me that tip again.,NEGATIVE,10,Being passive-aggressive,"the speaker is being aggressive and visibly annoyed with the program he is using, which is awkward",2021-04-08 13:03:19.295676+00:00
556,ES2008b,1117.51,B,"Sorry about this, guys.",POSITIVE,9,Being respectful,"The speaker is apologizing to the team, showing that he is respectful of them",2021-04-08 13:03:44.750272+00:00
556,ES2008b,1181.11,A,Excellent.,POSITIVE,12,Being positive,The speaker is complimenting the idea being presented by his teammate.,2021-04-08 13:04:10.332882+00:00
556,ES2008b,1229.49,C,"Never heard that before, that's good.",POSITIVE,3,Being positive,"the speaker is complimenting the phrase that his teammate had just said, making them feel good",2021-04-08 13:04:35.747293+00:00
874,ES2008b,1097.07,B,"Sorry about that, guys.",POSITIVE,12,Being respectful,"This person is acknowledging that something they did could be inconveniencing the others. By doing so, they are also expressing accountability by saying sorry.",2021-04-08 13:57:02.429548+00:00
874,ES2008b,1117.51,B,"Sorry about this, guys.",POSITIVE,9,Being respectful,This person is acknowledging that there is something bothersome going on and in order to account for that they are saying sorry. This is a good practice of being respectful.,2021-04-08 13:57:49.867070+00:00
874,ES2008b,1118.67,B,I'm kind of pathetic with things like this.,NEGATIVE,10,Causing embarrassment,"This person is basically making fun of themselves. While it isn't directed towards any other group members but him or herself, it could be interpreted as negative and psychologically harmful.",2021-04-08 13:58:42.596293+00:00
874,ES2008b,1138.01,B,So hopefully that makes sense for everyone in my kind of garbled way.,NEGATIVE,3,Causing embarrassment,"This person is putting themselves down with the comment of ""...in my kinda of garbled way."" This could be seen as negative and self-deprecating.",2021-04-08 13:59:39.762513+00:00
874,ES2008b,1181.11,A,Excellent.,POSITIVE,12,Being positive,This person is praising and supporting the last comment regarding the working design. This is a really great way to keep the group motivated and staying on task!,2021-04-08 14:00:22.584302+00:00
772,ES2008b,1091.75,A,Um yeah use that thing,POSITIVE,2,Being respectful,It is kind and respectful to help out someone who is having trouble.,2021-04-08 14:01:20.858643+00:00
772,ES2008b,1097.07,B,"Sorry about that, guys.",POSITIVE,12,Being respectful,It is polite to apologize when you have made an error and shows you are about others.,2021-04-08 14:01:56.082127+00:00
772,ES2008b,1098.85,A,Pardon.,POSITIVE,4,Being respectful,Showing manners and pardoning yourself when coughing shows you respect others.,2021-04-08 14:03:26.596513+00:00
772,ES2008b,1107.22,A,Double click on it.,POSITIVE,2,Being respectful,It is polite to let the other participant know how to make something work..,2021-04-08 14:04:03.522731+00:00
772,ES2008b,1117.51,B,"Sorry about this, guys.",POSITIVE,9,Being respectful,It is polite to apologize if something is not going well when speaking.,2021-04-08 14:04:34.278067+00:00
558,ES2008b,1117.51,B,"Sorry about this, guys.",POSITIVE,9,Being respectful,"You were apologetic about the presentation being delayed, which shows that you care about the others and their time.",2021-04-08 14:37:10.571259+00:00
558,ES2008b,1118.67,B,I'm kind of pathetic with things like this.,NEGATIVE,10,Being self deprecating,"By putting yourself down, you make the atmosphere more negative rather than positive and safe.",2021-04-08 14:38:19.939485+00:00
