user_id,dataset,timestamp,speaker,line,direction,agree_cnt,reason,possible_comment,created_at
363,ES2004b,319.7,D,"Could I can I interject to ask a question there, is that appropriate?",POSITIVE,8,Being respectful,"This was a great way to introduce an opinion or ask a question by taking a moment to ask if it is a good time, by doing that it shows respect to the group.",2021-03-24 10:38:34.896734+00:00
363,ES2004b,1406.93,C,they're c uh just generally Japanese people have smaller hands so they couldn't get round the controller which is uh so if you I don't know what 'cause you obviously you can have bigger buttons for some countries or something and smaller ones for others.,NEGATIVE,9,Dismissing others,"It is considered a racial stereotype to say ""all x race have x"" which is said here about Japanese people having small hands.",2021-03-24 10:43:46.045989+00:00
363,ES2004b,2088.17,D,"that sounds a really attractive idea, I've not come across anything like that before, if it kind of yeah and that opens out into your flip-top.",POSITIVE,9,Being positive,This was a great positive sentiment to bring the vibes up toward the other's idea and complimenting it.,2021-03-24 10:48:03.705019+00:00
363,ES2004b,2339.29,B,Um and I'll be able to not answer them.,NEGATIVE,5,Being passive-aggressive,Saying that they would not be able to answer the group's questions seems passive aggressive.,2021-03-24 10:50:00.658729+00:00
363,ES2004b,218.686,B,<sound: laugh>,NEGATIVE,2,Being passive-aggressive,Laughing at the previous person's design that they presented seems like a passive-aggressive and negative thing to do.,2021-03-24 10:51:21.995979+00:00
426,ES2004b,319.7,D,"Could I can I interject to ask a question there, is that appropriate?",POSITIVE,8,Being respectful,"Requested permission to ask a question, rather than just talking over the current speaker.",2021-03-24 13:21:22.264926+00:00
772,ES2004b,48.39,D,Oh God.,NEGATIVE,3,Causing annoyance,You made it seem you are frustrated with the troubles B is having.,2021-03-24 13:24:07.066373+00:00
772,ES2004b,72.604,C,<sound: laugh>,NEGATIVE,1,Causing embarrassment,You have embarrassed B by laughing at the trouble they are having.,2021-03-24 13:24:43.061678+00:00
772,ES2004b,80.31,D,"Uh, no that's okay, sorry.",POSITIVE,2,Being respectful,You gave an apology to B for doing something that was disruptive.,2021-03-24 13:25:33.011050+00:00
772,ES2004b,171.01,D,"Um is it okay if I postpone that til later, I just want to get access to a little bit more information, is that okay?",POSITIVE,2,Being respectful,You showed respect for B and asked permission for something to be done.,2021-03-24 13:26:40.339216+00:00
772,ES2004b,175.03,B,"No that's fine, that's fine.",POSITIVE,4,Being agreeable,You were generous to agree with the needs of D.,2021-03-24 13:27:04.017966+00:00
426,ES2004b,1233.66,D,That's a super idea.,POSITIVE,19,Being positive,The speaker is giving positive reinforcement of another speaker's ideas.,2021-03-24 13:27:04.903962+00:00
426,ES2004b,1714.61,D,"Excellent, mm-hmm.",POSITIVE,4,Being agreeable,The speaker is acknowledging and enthusiastically agreeing with the statement of another speaker.,2021-03-24 13:31:40.578656+00:00
426,ES2004b,1723.2,D,"Can I just run this past you while it occurs to me, I don't mean to quickly jump from one subject to another, but just discussing the different age groups and targeting the different age groups it occurs to me,",NEGATIVE,1,Dismissing others,The speaker asks for permission to change the topic but doesn't actually wait for permission to be given before switching topics.,2021-03-24 13:32:59.175343+00:00
426,ES2004b,2339.29,B,Um and I'll be able to not answer them.,NEGATIVE,5,Dismissing others,"The speaker states that they are open to receiving questions over email, but they won't answer them.",2021-03-24 13:36:33.772112+00:00
110,ES2004b,74.21,B,"Um, right our agenda for today, do you want us to give you a second?",NEGATIVE,1,Causing annoyance,"Hey buddy, if you suspect someone needs a moment, please consider offering a helping hand. Because while time is infinite, the group's time is not.",2021-03-24 16:47:44.468571+00:00
110,ES2004b,101.81,B,"Um, that it was important that the product was accessible to a wide range of consumers, wide age range, not limiting anyone.",POSITIVE,2,Being positive,"On behalf of those who are not here, we thank you today for a better remote tomorrow.",2021-03-24 16:49:16.828377+00:00
110,ES2004b,112.16,B,"We decided it was important to reflect the company's image in our product, we put fashion in electronics, you know that kind of s thing.",NEGATIVE,1,Being sarcastic,"Please consider clarifying this statement more. Do you mean to say that the fashion and technology are a real area of focus? If not, the ambiguity could distract focus from the quality of the product.",2021-03-24 16:52:19.548597+00:00
110,ES2004b,176.5,C,"Okay, yeah I'll go first.",POSITIVE,2,Being agreeable,"Hey buddy, way to be a team player. That speedy reaction to the unexpected turn of events really minimized the group's intermission time and helped speed the meeting right along.",2021-03-24 16:56:02.298354+00:00
110,ES2004b,195.96,B,function F_ eight.,POSITIVE,1,Being agreeable,Great job with the tech tip friend! Keyboard shortcuts are immensely useful in a time constrained environment and it is always nice to demonstrate your skill set with a specific tool!,2021-03-24 16:59:11.426602+00:00
110,ES2004b,228.85,C,"Well, a device which basically just sends the signal to the T_V_ to change its state, whether that be the power, or the channel um or the volume, everything is just um some sort of signal to change the state of the T_V_ or other appliance that it's sending the signal to.",POSITIVE,1,Being respectful,"Great idea to begin with a summary of the technical details. These are so important, but often overlooked. Way to make an effort to help your team become more familiar with the product and to explain the digital communication process used in our daily routines!",2021-03-24 17:02:24.380098+00:00
782,ES2004b,66.81,B,"Right, okay um, this is our second meeting and I might be a bit all over the place.",POSITIVE,2,Being positive,Being honest is comforting and promotes a healthy work environment,2021-03-24 19:42:50.672156+00:00
782,ES2004b,74.21,B,"Um, right our agenda for today, do you want us to give you a second?",POSITIVE,3,Being respectful,Asking about the needs of others involved is inclusive and welcoming.,2021-03-24 19:43:31.506730+00:00
782,ES2004b,175.03,B,"No that's fine, that's fine.",POSITIVE,4,Being agreeable,This person was being accommodating to another's request for more time.,2021-03-24 19:45:10.527418+00:00
782,ES2004b,218.686,B,<sound: laugh>,NEGATIVE,2,Dismissing others,The laugh comes across as condescending and belittling in response to the designer's sentence.,2021-03-24 19:46:38.688960+00:00
782,ES2004b,319.7,D,"Could I can I interject to ask a question there, is that appropriate?",POSITIVE,8,Being respectful,Asking for permission to ask a question so as not to interrupt but to also ask for clarity is important to promoting a good work environment.,2021-03-24 19:48:02.745858+00:00
190,ES2004b,66.81,B,"Right, okay um, this is our second meeting and I might be a bit all over the place.",POSITIVE,2,Being agreeable,Agrees that it is their first meeting but there is an unique association;,2021-03-24 21:41:17.137822+00:00
190,ES2004b,85.93,B,"I'll go over what we decided last meeting,",POSITIVE,1,Being respectful,The speaker is offering to remind the team what they had on their last meeting.,2021-03-24 21:42:23.772996+00:00
190,ES2004b,120.23,B,"Um, our budget would have to affect um try not to reflect our budget, um that we might",NEGATIVE,2,Being sarcastic,The speaker sacarstically says that the other person should noyt try to copy their budget,2021-03-24 21:44:02.912304+00:00
190,ES2004b,176.5,C,"Okay, yeah I'll go first.",POSITIVE,2,Being agreeable,Here the speake agrees tobe the first to go and the others will follow.,2021-03-24 21:45:57.336216+00:00
190,ES2004b,225.01,C,What the first thing question I asked was what are we trying to design?,NEGATIVE,1,Causing annoyance,The tone of the speaker is harsh as He reminds the audience of what he had said ealier.,2021-03-24 21:47:30.925960+00:00
785,ES2004b,38.83,B,"Okay, that's fine.",POSITIVE,2,Being positive,Being emphatic and acknowledging the problem of the other user.,2021-03-24 22:52:35.384479+00:00
785,ES2004b,74.21,B,"Um, right our agenda for today, do you want us to give you a second?",POSITIVE,3,Being respectful,Acknowledging that other person is behind and offering additional time.,2021-03-24 22:53:41.636219+00:00
785,ES2004b,134.224,C,<sound: laugh>,POSITIVE,2,Being positive,Acknowledging the joke and keeping the mood of the meeting light.,2021-03-24 22:55:06.891445+00:00
785,ES2004b,168.66,B,shall we hear from Marketing first?,POSITIVE,1,Being respectful,Posing a question rather than dictating who should go first.,2021-03-24 22:55:47.283543+00:00
785,ES2004b,175.03,B,"No that's fine, that's fine.",POSITIVE,4,Being agreeable,Offering marketing additional time when requested shows respect and understanding.,2021-03-24 22:56:33.209396+00:00
627,ES2004b,48.39,D,Oh God.,NEGATIVE,3,Causing embarrassment,"This directly calls out someone's mistake or error, even if it's their own. No matter how ""Oh God"" is said, it's not going to make anyone want to speak.",2021-03-25 01:04:24.171406+00:00
627,ES2004b,212.5,C,"Okay this is uh the working design, presented by me, the uh Industrial Designer extraordinaire.",POSITIVE,1,Being positive,There's an obvious sense of humor here and it's definitely seen as a positive as it grabs some laughs.,2021-03-25 01:05:48.017958+00:00
627,ES2004b,274.9,C,"So um, yeah I ran out of time so I couldn't do this one as fun as the last one",POSITIVE,1,Being positive,The speaker is being light-hearted and using humor. This is good for helping people feel safe.,2021-03-25 01:07:05.180749+00:00
627,ES2004b,773.02,A,"Uh any comments like, if you want?",POSITIVE,1,Being respectful,Offers others a direct chance to ask questions and have input on what was just said.,2021-03-25 01:08:31.102260+00:00
627,ES2004b,1027.78,A,'Kay.,NEGATIVE,2,Dismissing others,It's very short and seems dismissive to me. I personally don't like the use of 'Kay at all.,2021-03-25 01:09:43.134025+00:00
788,ES2004b,55.45,B,Are we done?,NEGATIVE,2,Causing frusturation,He is causing frustration as he just wants the meeting to be over and seems uninterested in the topic.,2021-03-25 03:55:46.065555+00:00
788,ES2004b,134.224,C,<sound: laugh>,POSITIVE,2,Being positive,Shows interest and engagement that lets the host know that he is reaching the group and has their attention.,2021-03-25 03:58:25.619065+00:00
788,ES2004b,209.34,A,Yep.,NEGATIVE,1,Being sarcastic,This is a sarcastic response as it is taking a little bit of time for the speaker to get it to work.  This can cause a disruption within the group and cause negative feelings.,2021-03-25 04:00:27.499840+00:00
788,ES2004b,517.15,D,"That's a very important part, it came up in our market research findings too so I can refer to that, whenever you like me to present.",POSITIVE,5,Being agreeable,"He is being agreeable about part of the design and reinforces that he thinks that is an important part of the design.  Again, this shows positive engagement with the group.",2021-03-25 04:05:39.901040+00:00
788,ES2004b,335.95,D,"Right, the triple A_s are the smallest you can get are they not, right?",NEGATIVE,1,Being passive-aggressive,"He is being passive aggressive with the speaker, stating that he doesn't understand how you can go smaller than the Triple-A batteries and although he is answered he continues asking about the battery size",2021-03-25 04:08:19.604869+00:00
788,ES2004b,515.94,D,Mm.,NEGATIVE,1,Causing annoyance,"This is the third straight response that is just ""Mm"" as he is not really adding any input or value to the conversation.",2021-03-25 04:09:18.664348+00:00
788,ES2004b,535.92,B,"Or, maybe move the laptop over.",NEGATIVE,4,Being sarcastic,"He is being sarcastic towards the speaker about him getting ready, and instead of adding a comment to help, he just sort of makes a remark to the room to get a laugh and can hurt the speakers confidence or moral.",2021-03-25 04:10:52.564234+00:00
654,ES2004b,38.83,B,"Okay, that's fine.",POSITIVE,2,Being agreeable,Saying it's fine is loosening the tension and letting everyone's mind at ease,2021-03-25 13:27:09.000282+00:00
654,ES2004b,72.604,C,<sound: laugh>,POSITIVE,1,Being positive,Laughing makes everyone feel better and boosts morale in meetings,2021-03-25 13:27:37.059658+00:00
654,ES2004b,80.31,D,"Uh, no that's okay, sorry.",POSITIVE,2,Being agreeable,They apologized for causing any potential inconvenience which makes everyone else feel more comfortable with making mistakes,2021-03-25 13:28:20.919781+00:00
654,ES2004b,74.21,B,"Um, right our agenda for today, do you want us to give you a second?",POSITIVE,3,Being respectful,Asking someone else if they need a moment to collect their thoughts encourages people to take their time,2021-03-25 13:28:46.921220+00:00
654,ES2004b,171.01,D,"Um is it okay if I postpone that til later, I just want to get access to a little bit more information, is that okay?",POSITIVE,2,Being respectful,Asking if they can postpone something they need to do for later is a good way to encourage an open dialogue for things that are uncomfortable to discuss,2021-03-25 13:29:45.510467+00:00
621,ES2004b,48.39,D,Oh God.,NEGATIVE,3,Causing embarrassment,The exaggeration may make someone feel embarrassed and make the environment tense.,2021-03-25 15:19:12.758001+00:00
621,ES2004b,55.45,B,Are we done?,NEGATIVE,2,Being passive-aggressive,Speech might come as a bit passive aggressive and those whom it's directed to might feel incompetent.,2021-03-25 15:20:26.535161+00:00
621,ES2004b,101.81,B,"Um, that it was important that the product was accessible to a wide range of consumers, wide age range, not limiting anyone.",POSITIVE,2,Being respectful,Clarifying in details to the person who's confused benefits them in remaining engaged.,2021-03-25 15:21:45.118340+00:00
621,ES2004b,120.23,B,"Um, our budget would have to affect um try not to reflect our budget, um that we might",NEGATIVE,2,Causing annoyance,"The constant use of ""um"" might annoy listeners and undermine the abilities of the speaker.",2021-03-25 15:22:42.572314+00:00
621,ES2004b,175.03,B,"No that's fine, that's fine.",POSITIVE,4,Being agreeable,Understanding the situation the team was in and agreeing to give them time is beneficial for them staying relaxed and prepared.,2021-03-25 15:24:00.615804+00:00
801,ES2004b,347.54,C,"Um, and d which leads sort of onto the next point about 'em being small and easy to carry round.",NEGATIVE,1,Being sarcastic,now the ones at the moment are small but i was just wondering,2021-03-29 14:49:03.883370+00:00
801,ES2004b,407.24,C,And then I was uh just had a quick look at the external design but I d I left that mostly to the uh interface designer.,POSITIVE,1,Being positive,and so this is what i had as the basic idea of what we wanna do,2021-03-29 14:50:04.571441+00:00
801,ES2004b,361.64,C,"Now the main components I came up with um were obviously the power source for the batteries 'cause otherwise it's not gonna work, uh as I said about the w which batteries we were gonna choose, we can uh discuss that later and then you obviously need something to decode the information that you're putting in from from the controller and to turn it into an i uh infrared signal which we're going to use to send the information.",POSITIVE,2,Being positive,And then i was as just had a quick look at the external design bud i did i left,2021-03-29 14:51:31.054435+00:00
801,ES2004b,354.61,C,"Um, now the ones at the moment are small but I was just wondering if we could look at something a bit smaller.",POSITIVE,1,Being positive,now the main components i came up with am were obviously the power source for the batteries cause otherwise it's not gonna work,2021-03-29 14:58:04.656987+00:00
801,ES2004b,361.64,C,"Now the main components I came up with um were obviously the power source for the batteries 'cause otherwise it's not gonna work, uh as I said about the w which batteries we were gonna choose, we can uh discuss that later and then you obviously need something to decode the information that you're putting in from from the controller and to turn it into an i uh infrared signal which we're going to use to send the information.",POSITIVE,2,Being positive,most people do so as were applying to the most audience that should be fine,2021-03-29 14:59:23.453050+00:00
625,ES2004b,319.7,D,"Could I can I interject to ask a question there, is that appropriate?",POSITIVE,8,Being respectful,"Asking questions shows that you are listening, and makes people feel heard. And asking in such a polite and respectful way really adds to the positive communication atmosphere being created.",2021-03-29 16:52:01.353396+00:00
625,ES2004b,338.28,B,They are.,POSITIVE,1,Being agreeable,It's good to show support when you know information that could help define an uncertainty between two people. Saying so in an even more nice way could show respect to both parties as well.,2021-03-29 16:53:51.641224+00:00
625,ES2004b,321.51,B,Mm-hmm.,POSITIVE,1,Being agreeable,"Great job showing verbal listening to the speaker, it allows them to feel they are being heard which is super important!",2021-03-29 16:54:31.088440+00:00
625,ES2004b,319.15,D,Mm-hmm.,POSITIVE,1,Being agreeable,"It's good to show that you are listening by giving small short verbal feedback, just like this, good job and keep it up!",2021-03-29 16:55:05.031879+00:00
625,ES2004b,517.15,D,"That's a very important part, it came up in our market research findings too so I can refer to that, whenever you like me to present.",POSITIVE,5,Being positive,"It seems like you jumped in just when the presenter was struggling to end their presentation. That's great that you showed you were listening, while also giving them room to think about how they might want to end. It would make them feel like they are doing a good job and giving important information. This was a perfect addition to the conversation.",2021-03-29 16:58:05.340367+00:00
772,ES2004b,302.49,C,"Now our one, I'm I'm not sure whether we want to look at the size issue because most of them are powered by triple A_ batteries but those can be quite bulky so I d I didn't know if you wanted to look at something else um so we could shrink down the size of the control.",POSITIVE,1,Being positive,"You have asked the input of others are used the term ""we"" which makes people feel included.",2021-03-29 18:01:06.424908+00:00
772,ES2004b,319.7,D,"Could I can I interject to ask a question there, is that appropriate?",POSITIVE,8,Being respectful,You have asked for permission to interject which shows you respect the other participants.,2021-03-29 18:01:48.242620+00:00
772,ES2004b,419.18,C,And so this is what I had as the basic idea of what we wanna do.,POSITIVE,1,Being agreeable,"Referring to the group as ""we"" makes everyone feel included.",2021-03-29 18:03:04.797154+00:00
772,ES2004b,510.91,C,<sound: laugh>,POSITIVE,1,Being agreeable,The laughter here seems to be something that bonds you a bit to the participants.,2021-03-29 18:04:50.018853+00:00
772,ES2004b,527.67,B,"Okay, thank you very much.",POSITIVE,5,Being respectful,Saying thank you shows respect for the other participants and their presentations.,2021-03-29 18:05:43.102177+00:00
827,ES2004b,319.7,D,"Could I can I interject to ask a question there, is that appropriate?",POSITIVE,8,Being respectful,"The speaker asked the group ""is that appropriate?"" after interjecting. This is polite to do and helpful to the conversation",2021-03-29 19:29:21.382388+00:00
827,ES2004b,517.15,D,"That's a very important part, it came up in our market research findings too so I can refer to that, whenever you like me to present.",POSITIVE,5,Being respectful,"This is a polite interjection, reminding about a presentation option but not in a rude way",2021-03-29 19:32:15.666879+00:00
827,ES2004b,1402.84,B,Were too big.,NEGATIVE,5,Being sarcastic,The user could cushion this statement more as to not cause any potential discomfort to the other listeners,2021-03-29 19:39:46.803530+00:00
827,ES2004b,1554.96,B,"That they want um it to be fashionable, they want it to be trendy and you wouldn't automatically assume associate that with the older generations.",NEGATIVE,7,Dismissing others,This comment could be offensive to an older person and is a bit dismissive,2021-03-29 19:42:06.363188+00:00
827,ES2004b,1723.2,D,"Can I just run this past you while it occurs to me, I don't mean to quickly jump from one subject to another, but just discussing the different age groups and targeting the different age groups it occurs to me,",POSITIVE,3,Being respectful,This is a polite way to jump back to another topic of discussion and be respectful of other people,2021-03-29 19:44:03.567686+00:00
835,ES2004b,325.58,C,"Um no no, if you if you look at if you look at most remote controls they're quite they're quite chunky and that's because of the size of the batteries, they have to be obviously this certain size to fit those batteries in.",NEGATIVE,2,Dismissing others,You cut the other person off mid sentence before they finished their thought/word.,2021-03-29 19:58:57.953292+00:00
835,ES2004b,527.67,B,"Okay, thank you very much.",POSITIVE,5,Being respectful,You saying thank you shows the other person appreciation and respect.,2021-03-29 20:04:14.565309+00:00
835,ES2004b,1233.66,D,That's a super idea.,POSITIVE,19,Being agreeable,You agreed the idea presented was good and that will keep everyone engaged.,2021-03-29 20:10:51.610809+00:00
835,ES2004b,1818.27,B,Instruction manuals.,NEGATIVE,2,Being passive-aggressive,"You corrected the person when they said instruction book , you wanted to be heard and said manuals instead. It's the same difference.",2021-03-29 20:20:09.241875+00:00
835,ES2004b,2088.17,D,"that sounds a really attractive idea, I've not come across anything like that before, if it kind of yeah and that opens out into your flip-top.",POSITIVE,9,Being positive,You are conveying to the person the idea they came up with is a good one.,2021-03-29 20:25:37.278731+00:00
571,ES2004b,535.92,B,"Or, maybe move the laptop over.",NEGATIVE,4,Being sarcastic,They were trying to undermine the other person and be sarcastic.,2021-03-29 21:13:39.412170+00:00
571,ES2004b,530.18,B,"Um, would you like to continue on from that?",POSITIVE,2,Being positive,Trying to help the other user speak up on the subject.,2021-03-29 21:14:20.895751+00:00
571,ES2004b,775.51,B,"Um, I think we'll chat about it at the end, okay so if anyone wants to write something down that they want to bring up at the end, um",NEGATIVE,1,Dismissing others,Them wanting to move the chat to the end was being dismissive.,2021-03-29 21:15:07.687128+00:00
571,ES2004b,1031.881,C,<sound: laugh>,NEGATIVE,2,Causing embarrassment,It was rude to laugh at this time when someone is doing a presentation.,2021-03-29 21:15:56.594349+00:00
571,ES2004b,1218.65,B,"use to find it needs to be something that you don't lose, you were saying whistling, maybe",NEGATIVE,1,Being passive-aggressive,They were putting down what had been said previously.,2021-03-29 21:16:44.238818+00:00
849,ES2004b,319.7,D,"Could I can I interject to ask a question there, is that appropriate?",POSITIVE,8,Being respectful,Asked to interject instead of just talking over other speaker.,2021-03-29 21:22:55.450621+00:00
849,ES2004b,775.51,B,"Um, I think we'll chat about it at the end, okay so if anyone wants to write something down that they want to bring up at the end, um",POSITIVE,1,Being respectful,Speaker encourages giving and receiving feedback and dedicates time for it.,2021-03-29 21:29:31.933852+00:00
9,ES2004b,535.92,B,"Or, maybe move the laptop over.",NEGATIVE,4,Causing annoyance,"This comment just sounds condescending to me, like it was made to show that the other person was being irritating. Not productive towards conversation.",2021-03-29 22:00:30.713161+00:00
9,ES2004b,527.67,B,"Okay, thank you very much.",POSITIVE,5,Being respectful,The person thanked the worker for their contribution to the discussion. Kind thing to do.,2021-03-29 22:03:05.863425+00:00
9,ES2004b,1355.18,B,"You don't have to press it, you just have to put your thumb onto it.",POSITIVE,4,Being respectful,is helping clarify so another person can understand what the button does,2021-03-29 22:06:06.050961+00:00
9,ES2004b,1378.74,B,"oh yeah that's obvious what that's for and it's not daunting to maybe the older generations, um",NEGATIVE,9,Dismissing others,dismissive towards older generations and just a rude comment in general.,2021-03-29 22:06:32.761387+00:00
9,ES2004b,1496.07,D,"I'm j I really can't get my head round this one, this may have to be postponed to a future meeting but it's something we should think about.",POSITIVE,6,Being agreeable,Ok with giving more time to an idea that needs more time. Wants to talk about it amongst the group before making any final decisions.,2021-03-29 22:07:35.664369+00:00
860,ES2004b,527.67,B,"Okay, thank you very much.",POSITIVE,5,Being respectful,The line shows a very polite way of addressing the others.,2021-03-30 01:50:40.139756+00:00
860,ES2004b,841.71,D,"Get it right over, okay, thank you.",POSITIVE,3,Being respectful,It is a comment that is showing gratitude and also confirmation.,2021-03-30 01:53:43.632020+00:00
860,ES2004b,1714.61,D,"Excellent, mm-hmm.",POSITIVE,4,Being positive,This is expressing a positive affirmative and being very agreeable.,2021-03-30 02:00:09.604109+00:00
