user_id,dataset,timestamp,speaker,line,direction,agree_cnt,reason,possible_comment,created_at
558,ES2008b,1161.76,B,"We need a straightforward interface, like Ian was saying, simple, not overwhelming it with information and we need a reliable and clear infra-red signal, so that you're not waving your remote around and having to get frustrated and go do it by hands.",POSITIVE,1,Being agreeable,"You are reinforcing that Ian's ideas were good, which helps everyone feel comfortable sharing more ideas.",2021-04-08 14:39:53.691386+00:00
558,ES2008b,1181.11,A,Excellent.,POSITIVE,12,Being positive,"By complimenting B's presentation, you help others feel positively about their ideas. Everyone will feel more comfortable contributing as a result.",2021-04-08 14:41:48.800019+00:00
558,ES2008b,1204.58,A,"Yes, absolutely.",POSITIVE,7,Being agreeable,"This line shows that you are happily willing to help out the presenter, which reinforces the team effort and improves psychological safety.",2021-04-08 14:43:19.114776+00:00
892,ES2008b,1093.28,A,"you can go back, previous.",POSITIVE,2,Being agreeable,he is active in the chat and helpful to others,2021-04-08 15:33:46.508452+00:00
892,ES2008b,1097.07,B,"Sorry about that, guys.",POSITIVE,12,Being respectful,is always good to admit your mistakes and this way keep a good vibe in the chat,2021-04-08 15:34:57.434781+00:00
892,ES2008b,1098.85,A,Pardon.,POSITIVE,4,Being respectful,a great way to excuse yourself when making any noise,2021-04-08 15:36:03.722384+00:00
892,ES2008b,1118.67,B,I'm kind of pathetic with things like this.,POSITIVE,1,Being agreeable,is good to admit your weaknesses and be open to learn.,2021-04-08 15:37:59.112612+00:00
892,ES2008b,1181.11,A,Excellent.,POSITIVE,12,Being positive,always be a team player and encourage others with good feedback.,2021-04-08 15:39:35.704842+00:00
779,ES2008b,1114.57,B,Don't show me that tip again.,NEGATIVE,10,Being passive-aggressive,This seems rather demanding and therefore harmful towards the others,2021-04-08 15:54:49.915311+00:00
779,ES2008b,1117.51,B,"Sorry about this, guys.",POSITIVE,9,Being positive,His apology is helping to diffuse any tension in the situation,2021-04-08 15:56:59.068637+00:00
779,ES2008b,1097.07,B,"Sorry about that, guys.",POSITIVE,12,Being positive,The apology diffuses some of the tension by placing the blame on himself,2021-04-08 15:57:49.693190+00:00
779,ES2008b,1091.75,A,Um yeah use that thing,NEGATIVE,1,Being passive-aggressive,The um yea makes it seem like hes being condescending towards the other person,2021-04-08 16:01:33.794559+00:00
779,ES2008b,1116.64,B,There we are.,POSITIVE,1,Being positive,He's announcing his success.  This makes for a more positive environment,2021-04-08 16:01:59.271185+00:00
1363,ES2008b,1114.57,B,Don't show me that tip again.,NEGATIVE,10,Causing frusturation,"The person is expressing frustration, which leads to a tense environment",2021-04-08 18:12:57.178186+00:00
1363,ES2008b,1181.11,A,Excellent.,POSITIVE,12,Being positive,Thank you for positively acknowledging another person with your comment.,2021-04-08 18:13:57.969467+00:00
1363,ES2008b,1093.28,A,"you can go back, previous.",POSITIVE,2,Being helpful,This comment is being helpful and supportive to the presenter without being frustrated or rude about it.,2021-04-08 18:15:31.786335+00:00
1363,ES2008b,1204.58,A,"Yes, absolutely.",POSITIVE,7,Being agreeable,Respectfully willing to help out is good for the psychological safety of the group.,2021-04-08 18:16:28.875120+00:00
1363,ES2008b,1229.49,C,"Never heard that before, that's good.",POSITIVE,3,Being positive,Pointing out and complimenting another person on a useful saying is very good for psychological safety!,2021-04-08 18:17:18.689102+00:00
1363,ES2008b,1324.43,C,"And you just type numbers to go to different pages and it gives you information, mostly rather boring stuff like what's on T_V_ next and share prices and that kind of thing.",NEGATIVE,2,Dismissing others,"Some people might not find the things that were mentioned to be boring, and it might harm psychological safety because they feel you are calling their interests boring.",2021-04-08 18:19:26.829249+00:00
1380,ES2008b,1148.72,B,<sound: laugh>,NEGATIVE,1,Being sarcastic,The line seemed sarcastic like they were trying to be rude and disrespectful. I would just tell speak to be mindful of what they say to others and sometimes it’s best to keep quite you have nothing nice or respectful to say.,2021-04-08 20:51:20.178489+00:00
1380,ES2008b,1117.92,D,<sound: cough>,NEGATIVE,1,Being passive-aggressive,I felt this very passive aggressive because they can say how the feel or what’s on their mind without doing a shady cough. I would tell D that to be upfront and express what’s on their mind in a respectful way that won’t offend anyone else.,2021-04-08 20:56:01.260084+00:00
1380,ES2008b,1114.57,B,Don't show me that tip again.,NEGATIVE,10,Dismissing others,This sounded a little dismissive. The person was just trying to help and B could have expressed they didn’t need the tip in a more politeful way. B came off a little rude. I would tell B to thank the person for the tip and tell them respectfully that they don’t need it.,2021-04-08 21:02:32.829308+00:00
1380,ES2008b,1097.07,B,"Sorry about that, guys.",POSITIVE,12,Being respectful,B was being respectful by acknowledging their mistake and being accountable. I would tell B to continue this future conversations because it’s very healthy and productive for all parties involved.,2021-04-08 21:06:55.819313+00:00
1380,ES2008b,1138.01,B,So hopefully that makes sense for everyone in my kind of garbled way.,POSITIVE,2,Being respectful,B is being respectful because they are making the others understand what he is explaining which is important in communication. I would tell B that this a positive response and it gives the opportunity to speak if they don’t understand.,2021-04-08 21:11:28.539021+00:00
1380,ES2008b,1091.75,A,Um yeah use that thing,POSITIVE,2,Being positive,I felt that A was trying their best to be help B work through their mistake. I would tell A to continue to be willing to assist other because it’s makes for a healthier and more productive interaction.,2021-04-08 21:29:43.478881+00:00
1380,ES2008b,1102.54,B,"Okay, let's just get back to my schematic here.",POSITIVE,2,Being agreeable,I felt that B was agreeing with A to move forward in the conversation. I would tell b that being agreeable making sure everyone is on accord can make conversations go so much smoother.,2021-04-08 21:33:18.518887+00:00
324,ES2008b,1118.67,B,I'm kind of pathetic with things like this.,NEGATIVE,10,Causing annoyance,"Although this person is putting themselves down, it may be annoying towards the others and make them feel uncomfortable.",2021-04-08 22:55:45.316060+00:00
324,ES2008b,1138.01,B,So hopefully that makes sense for everyone in my kind of garbled way.,NEGATIVE,3,Causing frusturation,"This comment is making this person appear incompetent and lacking self confidence, which can make others feel bad for them.",2021-04-08 22:56:44.480378+00:00
324,ES2008b,1181.11,A,Excellent.,POSITIVE,12,Being agreeable,This comment lets the other know they agree with their ideas shared and feel it is good work.,2021-04-08 22:57:33.422654+00:00
324,ES2008b,1229.49,C,"Never heard that before, that's good.",POSITIVE,3,Being positive,This let's the other person know they find their help and advice useful and also something new they have learned from them.,2021-04-08 22:58:17.920146+00:00
324,ES2008b,1239.76,D,"Yeah, that's a good one it'll stick with you.",POSITIVE,1,Being positive,This lets the other person know that their words and help will stick with them for a long time.,2021-04-08 22:59:34.446612+00:00
882,ES2008b,1097.07,B,"Sorry about that, guys.",POSITIVE,12,Being respectful,They are asking forgiveness about whatever made anyone uncomfortable or uneasy.,2021-04-08 23:11:46.878550+00:00
882,ES2008b,1102.54,B,"Okay, let's just get back to my schematic here.",NEGATIVE,2,Causing annoyance,This person is annoying because he thinks it's all about HIS schematic.,2021-04-08 23:12:44.857572+00:00
882,ES2008b,1114.57,B,Don't show me that tip again.,NEGATIVE,10,Dismissing others,They are being rude and dismissive other peoples ideas or thoughts.,2021-04-08 23:14:02.006996+00:00
882,ES2008b,1118.67,B,I'm kind of pathetic with things like this.,NEGATIVE,10,This person is giving off bad vibes and insecurity where their job is concerned.,This person is giving off bad vibes and insecurity where their job is concerned.,2021-04-08 23:18:25.318012+00:00
882,ES2008b,1148.72,B,"personal preferences, besides the fact that I can't spell, we need a long-lasting energy source, people don't wanna be changing it a lot.",NEGATIVE,2,A person in this position should know how to spell. This is frightening and can affect the entire group with one slip-up!,It let the others in the group know that this person has enormous challenges in spelling.,2021-04-08 23:21:17.169599+00:00
1400,ES2008b,1114.57,B,Don't show me that tip again.,NEGATIVE,10,Causing embarrassment,It is rude to tell someone who is trying to be helpful not to provide a tip again.,2021-04-09 01:47:10.858056+00:00
1400,ES2008b,1138.01,B,So hopefully that makes sense for everyone in my kind of garbled way.,POSITIVE,2,Being agreeable,This comment is self deprecating which is a technique that puts others at ease.,2021-04-09 01:48:27.252557+00:00
1400,ES2008b,1101.41,B,"No, no, no, no, no.",NEGATIVE,1,Dismissing others,This seems like a somewhat harsh way to express frustration.,2021-04-09 01:50:31.296569+00:00
1400,ES2008b,1117.51,B,"Sorry about this, guys.",POSITIVE,9,Being respectful,This person is apologetic that things are not going smoothly which shows that he appreciates the others’ time and feels bad about the frustrating situation.,2021-04-09 01:52:08.838377+00:00
1400,ES2008b,1118.67,B,I'm kind of pathetic with things like this.,NEGATIVE,10,Causing embarrassment,"Even though this person is talking about himself, it still is a very negative statement to make and counterproductive.",2021-04-09 01:53:39.367796+00:00
961,ES2008b,1349.01,D,That's good.,POSITIVE,3,Being positive,It reinforced safety by expressing that someone else's statement was good.,2021-04-09 10:45:46.036338+00:00
961,ES2008b,1350.94,A,Interesting.,POSITIVE,3,Being agreeable,This person is showing a great interest in the conversation with their statement.,2021-04-09 10:46:12.874713+00:00
961,ES2008b,1371.09,C,Right.,POSITIVE,3,Being respectful,They are kindly answering Person A's statement in the for of reiterating that it is correct.,2021-04-09 10:46:50.030414+00:00
961,ES2008b,1379.26,B,'Kay.,NEGATIVE,1,Dismissing others,"The way the word ""okay"" was expressed is showing a very dismissive sentiment.",2021-04-09 10:47:24.473499+00:00
961,ES2008b,1404.71,C,Yeah.,POSITIVE,1,Being agreeable,"They are reiterating agreement with the rest of the group simply by saying ""yeah"", a sign of approval.",2021-04-09 10:48:04.711098+00:00
790,ES2008b,1349.01,D,That's good.,POSITIVE,3,Being positive,"It's a good practice to tolerate others by appraising them, it helps participant to build positive self image.",2021-04-09 11:21:44.319259+00:00
790,ES2008b,1352.54,A,"Okay um, well, we're not gonna the management has decided we're not gonna work with that.",NEGATIVE,3,Dismissing others,"It is a bad practice to dismiss others during meetings, participants should rather practice tolerance and  build participants self image.",2021-04-09 11:29:31.761428+00:00
790,ES2008b,1371.09,C,Right.,POSITIVE,3,Being agreeable,"It's a good practice to agree with others during meetings, it helps participant to build positive self image.",2021-04-09 11:30:37.382565+00:00
790,ES2008b,1398.31,A,"Looks like, yeah, kind of a yellow and black and we have that the emphasis on the R_s in um mm-hmm.",POSITIVE,3,Being agreeable,"It's a good practice to agree with others without arguments, it helps participant to build positive self image.",2021-04-09 11:32:22.306778+00:00
790,ES2008b,1410.26,A,fashion in electronics.,POSITIVE,1,Being positive,It's a good practice to make jokes during formal meetings to ease tension and encourage every participant to fully contribute.,2021-04-09 11:35:23.832843+00:00
884,ES2008b,1371.09,C,Right.,POSITIVE,3,Being agreeable,The member is being positive and agreeable with the other members idea.,2021-04-09 12:16:16.702952+00:00
884,ES2008b,1376.56,A,We only have a a short amount of time.,POSITIVE,2,Being agreeable,The mem ber is agreeing to what they need to focus on for the remote.,2021-04-09 12:17:11.308529+00:00
884,ES2008b,1416.71,A,Yep.,POSITIVE,2,Being positive,The member is supporting the other members idea in a positive way,2021-04-09 12:19:12.617568+00:00
884,ES2008b,1431.53,A,We need to decide who our target group is.,POSITIVE,2,Being positive,The member is pointing out they need to identify the target group,2021-04-09 12:20:23.921947+00:00
884,ES2008b,1436.67,D,Mm-hmm.,POSITIVE,2,Being positive,The member is positively agreeing with the other members idea.,2021-04-09 12:21:13.000723+00:00
772,ES2008b,1363.18,A,"Okay um and we're also gonna w like your question earlier um whether this is going to be t for television, video, or etcetera.",POSITIVE,2,Being respectful,Referencing a question someone had earlier means you appreciate their question and you are paying attention.,2021-04-09 13:15:23.889993+00:00
772,ES2008b,1371.02,A,That's what we're focused on.,POSITIVE,1,Being respectful,It shows respect to say we here and reinforces you see others as part of a group.,2021-04-09 13:16:01.668879+00:00
772,ES2008b,1412.18,A,So we gotta keep that in that in mind.,POSITIVE,2,Being respectful,Using the word we here reinforces you see the group as a team and  you count on input from others.,2021-04-09 13:17:13.692902+00:00
772,ES2008b,1413.856,C,<sound: laugh>,NEGATIVE,1,Dismissing others,Laughing here could be dismissive of the instruction that was just given.,2021-04-09 13:17:44.022125+00:00
772,ES2008b,1422.04,B,Okay.,POSITIVE,1,Being agreeable,You have shown agreement with instructions given which shows you are on board.,2021-04-09 13:18:22.181397+00:00
9,ES2008b,1335.36,C,"Yep, news headlines.",POSITIVE,2,Being agreeable,Agreeing with previous group member on the the types of headlines that you see using remote.,2021-04-09 14:01:56.740054+00:00
9,ES2008b,1398.31,A,"Looks like, yeah, kind of a yellow and black and we have that the emphasis on the R_s in um mm-hmm.",POSITIVE,3,Being respectful,Clarifying the question of what the corporate image looks like coming from another group member.,2021-04-09 14:02:31.182625+00:00
9,ES2008b,1456.0,B,"Well if we're gonna say that function um fashion we put the fashion in in electronics then you automatically, I think, a sort of younger group that that's who's gonna be attracted to this.",POSITIVE,1,Being respectful,Clarifying the question from other group member asking what the aim is.,2021-04-09 14:02:59.102841+00:00
9,ES2008b,1546.21,C,"I I would say no, because it's gonna add too much to the price.",POSITIVE,1,Being respectful,Respectfully giving their opinion on whether or not to use voice recognition.,2021-04-09 14:03:28.602368+00:00
9,ES2008b,1687.33,C,"I think that's a good idea, yeah.",POSITIVE,6,Being agreeable,Agreeing with the previous idea stated by another group member in discussion.,2021-04-09 14:04:43.975450+00:00
892,ES2008b,1352.54,A,"Okay um, well, we're not gonna the management has decided we're not gonna work with that.",POSITIVE,1,Being agreeable,reminding everyone about the rules that they need to follow.,2021-04-09 14:55:10.916330+00:00
892,ES2008b,1376.56,A,We only have a a short amount of time.,POSITIVE,2,Being respectful,make sure that others understand the dead end of the project.,2021-04-09 14:56:45.335415+00:00
892,ES2008b,1394.24,C,So what's our corporate image like?,POSITIVE,1,Being respectful,is good to hear others opinion on the discussed topic.,2021-04-09 14:57:33.757440+00:00
892,ES2008b,1398.31,A,"Looks like, yeah, kind of a yellow and black and we have that the emphasis on the R_s in um mm-hmm.",POSITIVE,3,Being agreeable,is good to agree and give  reply to others questions.,2021-04-09 14:58:20.733848+00:00
892,ES2008b,1416.71,A,Yep.,POSITIVE,2,Being agreeable,always approve the ideas that you find useful for the project.,2021-04-09 14:59:13.583047+00:00
719,ES2008b,1335.36,C,"Yep, news headlines.",POSITIVE,2,Being agreeable,The person agrees and then adds their own little quip to it.,2021-04-09 15:27:00.624501+00:00
719,ES2008b,1345.62,D,That explains a lot.,POSITIVE,2,Being agreeable,The person shows that the information was helpful in understanding something.,2021-04-09 15:27:27.996479+00:00
719,ES2008b,1596.27,A,That's a good thing to keep in mind.,POSITIVE,13,Being positive,This line shows that the previous information is important and it should be remembered.,2021-04-09 15:29:07.431120+00:00
719,ES2008b,1615.08,B,"Yeah, simplification.",POSITIVE,7,Being agreeable,The person agrees and then adds their own reasoning to it as well.,2021-04-09 15:29:54.484077+00:00
719,ES2008b,1685.73,B,"Yeah, that's a good idea.",POSITIVE,13,Being agreeable,"The person agrees that the participant had a good idea, making the person feel heard.",2021-04-09 15:30:50.319134+00:00
719,ES2008b,1714.8,A,"Okay, those are very good goals, I think, um that we have to keep in mind in with everything we do.",POSITIVE,9,Being agreeable,The person shows that they agree and that the ideas are good.,2021-04-09 15:31:55.832004+00:00
571,ES2008b,1363.18,A,"Okay um and we're also gonna w like your question earlier um whether this is going to be t for television, video, or etcetera.",POSITIVE,2,Being respectful,They are being respectful to the group by laying out the plan for the meeting,2021-04-09 18:17:56.516936+00:00
571,ES2008b,1449.65,A,Um and so who are we aiming this at?,POSITIVE,1,Being respectful,They are asking the entire group for input on this idea.,2021-04-09 18:18:27.407208+00:00
571,ES2008b,1685.73,B,"Yeah, that's a good idea.",POSITIVE,13,Being positive,They are saying that the other person had a good idea for the project.,2021-04-09 18:20:46.416648+00:00
571,ES2008b,1773.28,D,"Well, I dunno how useful that number is if we're not doing",NEGATIVE,3,Dismissing others,They are dismissing what the other person is saying without taking their idea in to consideration,2021-04-09 18:23:00.114472+00:00
571,ES2008b,1854.0,C,I think the product appeals across a quite a broad range of ages.,POSITIVE,5,Being positive,They are trying to be postive while the rest of the group squabbles about age ranges.,2021-04-09 18:23:45.303144+00:00
1123,ES2008b,1350.94,A,Interesting.,POSITIVE,3,Being positive,Great positive feedback! This lets the speaker know you are interested in what they are saying.,2021-04-09 18:33:38.149214+00:00
1123,ES2008b,1525.7,B,"Yeah, that's probably uh a population w quite a little bit of disposable income for use on technology anyway, so that might be a fairly good target group for us.",POSITIVE,2,Being agreeable,"Agreeing with, and expanding upon what the other speaker is saying is great! Great group dynamics!",2021-04-09 18:37:18.372228+00:00
1123,ES2008b,1569.65,D,"But what else are we gonna put, I mean not that I'm really gung-ho about it, I don't know what else you can put in a remote to make it technologically advanced though.",NEGATIVE,5,Dismissing others,This comment can be reworded to add to the discussion rather than voicing negativity.,2021-04-09 18:39:17.451496+00:00
1123,ES2008b,1596.27,A,That's a good thing to keep in mind.,POSITIVE,13,Being agreeable,Great positive feedback! Agreeing with members of the group keeps the group environment positive.,2021-04-09 18:40:40.141103+00:00
1219,ES2008b,1615.08,B,"Yeah, simplification.",POSITIVE,7,Being agreeable,It's good to respond to another's idea to acknowledge their contributions.,2021-04-09 18:41:28.533338+00:00
1123,ES2008b,1649.1,C,"The remote There are remote controls like that, yeah.",POSITIVE,1,Being agreeable,Great reinforcement! You are showing the speaker you are listening to their ideas and agree with what they are saying.,2021-04-09 18:42:27.260960+00:00
1219,ES2008b,1650.25,A,Kind of pull out of the side.,POSITIVE,1,Being agreeable,Responding to another group member when asked a question is a good habit because it shows that you're engaged with and respect them.,2021-04-09 18:43:01.066482+00:00
1123,ES2008b,1685.73,B,"Yeah, that's a good idea.",POSITIVE,13,Being agreeable,You are showing that you like a group members ideas. This is great for positive group dynamics!,2021-04-09 18:43:47.096720+00:00
1219,ES2008b,1685.73,B,"Yeah, that's a good idea.",POSITIVE,13,Being positive,Pointing out good ideas from other participants is encouraged because it shows you care and are considering their ideas along with your own.,2021-04-09 18:44:24.662970+00:00
1123,ES2008b,1687.33,C,"I think that's a good idea, yeah.",POSITIVE,6,Being agreeable,Group members feel good when they are given positive feedback. Great job!,2021-04-09 18:44:31.939698+00:00
1219,ES2008b,1687.33,C,"I think that's a good idea, yeah.",POSITIVE,6,Being positive,The participant agreed with the other which shows they are viewing the other member as an equal and valid participant.,2021-04-09 18:45:43.573447+00:00
1123,ES2008b,1696.69,B,Good point.,POSITIVE,8,Being agreeable,Great positive way to add to the conversation! People feel more comfortable expressing their ideas when they are given positive feedback.,2021-04-09 18:45:56.505911+00:00
1219,ES2008b,1696.69,B,Good point.,POSITIVE,8,Being positive,Mentioning good ideas from other people is encouraged because it pays them respect and shows you are engaged with their ideas.,2021-04-09 18:46:40.487811+00:00
1123,ES2008b,1714.8,A,"Okay, those are very good goals, I think, um that we have to keep in mind in with everything we do.",POSITIVE,9,Being positive,This is a great and positive way to sum up the goals of the group.,2021-04-09 18:46:53.013064+00:00
1219,ES2008b,1714.8,A,"Okay, those are very good goals, I think, um that we have to keep in mind in with everything we do.",POSITIVE,9,Being agreeable,Constructive criticism is positive when working with multiple ideas from different people.,2021-04-09 18:47:31.762960+00:00
1123,ES2008b,1773.28,D,"Well, I dunno how useful that number is if we're not doing",NEGATIVE,3,Dismissing others,This comment can be reworded so that it does not dismiss the ideas of other members of the group.,2021-04-09 18:48:56.004425+00:00
1123,ES2008b,1796.88,C,"It's for, like, the ultimately lazy people, who can't even be bothered to pick up the remote.",NEGATIVE,6,Causing embarrassment,This comment is negative and unnecessary. It does not add to the conversation.,2021-04-09 18:49:56.142491+00:00
1123,ES2008b,1885.3,B,That's a good point.,POSITIVE,10,Being agreeable,Great pointing out the other group members' good ideas. Adds to the positivity of the group.,2021-04-09 18:52:14.660324+00:00
1123,ES2008b,2084.7,A,"that's a good idea, we'll keep it.",POSITIVE,10,Being positive,Positive comments reinforce a positive group environment. Keep up the great positivity!,2021-04-09 18:55:01.570327+00:00
1123,ES2008b,2160.71,A,Great seeing y'all.,POSITIVE,5,Being positive,Great way to wrap up the meeting on a positive note.,2021-04-09 18:56:08.940659+00:00
654,ES2008b,1345.62,D,That explains a lot.,POSITIVE,2,Being positive,They're complimenting someone else's explanation saying it's very helpful.,2021-04-09 19:41:37.464504+00:00
654,ES2008b,1349.01,D,That's good.,POSITIVE,3,Being positive,They're complimenting someone else's explanations saying that it was good which is considerate and nice.,2021-04-09 19:42:02.968193+00:00
654,ES2008b,1352.54,A,"Okay um, well, we're not gonna the management has decided we're not gonna work with that.",NEGATIVE,3,Dismissing others,They're being dismissive of what the other group member are talking about since they can't do anything with it.,2021-04-09 19:42:37.292446+00:00
654,ES2008b,1372.54,A,"Um otherwise becomes to complex, we wanna get this out um very quickly.",POSITIVE,1,Being constructive,They're helping center the focus of the group on what they need to be working on.,2021-04-09 19:43:13.869280+00:00
654,ES2008b,1431.53,A,We need to decide who our target group is.,POSITIVE,2,Being constructive,They're making the group focus on what they need to get done.,2021-04-09 19:44:18.023303+00:00
225,ES2008b,1345.62,D,That explains a lot.,NEGATIVE,1,Being sarcastic,"overgeneralized based on age and preference, assuming theres a type of person who likes those types of games",2021-04-09 20:54:49.861999+00:00
225,ES2008b,1410.26,A,fashion in electronics.,NEGATIVE,1,stereotype assumptions,"suggests fashion and electronics should be separate, hinting at gender dominance in electronics and femininity with fashion",2021-04-09 20:58:25.377190+00:00
225,ES2008b,1525.7,B,"Yeah, that's probably uh a population w quite a little bit of disposable income for use on technology anyway, so that might be a fairly good target group for us.",POSITIVE,2,Being agreeable,acknowledged the data  driven support for the group target proposal,2021-04-09 21:01:12.841464+00:00
225,ES2008b,1589.57,B,"Everything we're talking about is ease of use and simple and that doesn't necessarily mean more technology, in fact it could use it could mean, not.",NEGATIVE,2,Dismissing others,"claims everything they discuss fits a template, which isn't necessarily uninimously agreed on",2021-04-09 21:05:44.734605+00:00
