user_id,dataset,timestamp,speaker,line,direction,agree_cnt,reason,possible_comment,created_at
772,ES2007c,815.45,C,<sound: laugh>,POSITIVE,2,Being positive,Laughing here is appropriate and responsive to the last speaker.,2021-04-05 15:48:42.871790+00:00
772,ES2007c,808.01,C,"So, yeah, I mean, like what's the point of saying, Hello remote, I mean, hello, how how are you?",POSITIVE,1,Being respectful,Your input is make in a way that shows you asking for input from others.,2021-04-05 15:49:18.137958+00:00
772,ES2007c,837.1,B,"So for the energy source, do we go for the battery or the",POSITIVE,1,Being respectful,Using we here shows you interested in the input of others.,2021-04-05 15:49:51.868677+00:00
772,ES2007c,851.04,B,Are you happy with that?,POSITIVE,8,Being respectful,Asking for input from others shows that you respect them.,2021-04-05 15:50:15.319475+00:00
823,ES2007c,755.69,D,"Mm, I dunno.",NEGATIVE,1,Dismissing others,This comment is a little too dismissive and informal - it could insult someone.,2021-04-05 18:30:21.813078+00:00
823,ES2007c,941.06,D,"Yeah, the rubber's good.",POSITIVE,5,Being positive,"This is positive feedback to a product inclusion, making the others feel like they are doing something good.",2021-04-05 18:32:00.324536+00:00
823,ES2007c,1148.4,A,Do we have an uh example of a good one?,NEGATIVE,6,Being sarcastic,"Taking a sarcastic or rude jab at the team's productivity/design options, which could hurt someone's feelings.",2021-04-05 18:33:33.667670+00:00
823,ES2007c,1315.86,A,Cool.,POSITIVE,3,Being agreeable,"Accepting what the presenter had to say, which makes them feel validated.",2021-04-05 18:34:56.504577+00:00
823,ES2007c,1463.16,A,"Okay, well, what do you two think about this?",POSITIVE,7,Being respectful,Including other participants on decisions and discussions is a good way to make people feel wanted.,2021-04-05 18:35:54.188531+00:00
540,ES2007c,757.77,D,Be cool.,NEGATIVE,1,Causing annoyance,"This comment is not terribly helpful as it offers no insight into what would make the remote ""cool"" so it's a low effort answer that doesn't improve the team task.",2021-04-05 20:08:22.871307+00:00
540,ES2007c,767.93,C,"speech recognition um option is it doesn't seem really very promising for us uh, 'cause uh",NEGATIVE,2,Causing annoyance,This person is giving a negative opinion without offering anything constructive to the idea other than they feel it is not worth investing into for the task.,2021-04-05 20:09:31.489506+00:00
540,ES2007c,808.01,C,"So, yeah, I mean, like what's the point of saying, Hello remote, I mean, hello, how how are you?",NEGATIVE,2,Being sarcastic,This statement is not giving much insight other than they do not think it is a useful feature. There are more constructive ways to express this without being annoying or sarcastic in nature.,2021-04-05 20:10:36.930061+00:00
540,ES2007c,814.2,B,"Just if you are really lonely, maybe.",NEGATIVE,3,Causing embarrassment,This is all stemming from an idea to make a speaker in the remote interactive so this is a joke at the idea and person's expense who came up with it.,2021-04-05 20:11:19.512233+00:00
540,ES2007c,815.45,C,"Yeah, if you're really lonely, it is it's",NEGATIVE,2,Causing frusturation,This comment reinforces negativity over an idea that really isn't very constructive. I can see there is humor intended here but it's really rubbing the point in at this rate towards the team member who suggested the idea.,2021-04-05 20:12:00.713905+00:00
540,ES2007c,824.89,C,It it's just a remote that talks to you.,NEGATIVE,3,Dismissing others,"This comment seems to downplay the idea that was offered by making it sound trivial in the given context. I don't think that's helpful to state that it is ""just a remote that talks to you"" as there are some people who could benefit from the interactive elements of a remote.",2021-04-05 20:13:18.095758+00:00
540,ES2007c,827.85,D,forget about it.,NEGATIVE,1,Dismissing others,I think this person is dismissing the idea provided earlier which comes across as rather negative and unproductive.,2021-04-05 20:14:09.853626+00:00
540,ES2007c,845.66,A,"It's cheap, it's cheerful, it's worked, does work.",POSITIVE,4,Being positive,This statement seems to offer a positive interpretation of thoughts shared by another team member which lets them know it is valued and has been heard.,2021-04-05 20:15:00.063111+00:00
556,ES2007c,876.83,A,"Yep, but we're going for the simple buttons.",POSITIVE,1,Being agreeable,The speaker is being cooperative with his team about the idea being presented.,2021-04-06 13:27:54.949126+00:00
556,ES2007c,906.53,A,But anything is gonna have buttons.,NEGATIVE,1,Being passive-aggressive,The speaker seems to be kind of frustrated and talking aggressively about the idea.,2021-04-06 13:28:27.304181+00:00
556,ES2007c,941.06,D,"Yeah, the rubber's good.",POSITIVE,5,Being positive,"The speaker is pleased with using rubber, showing that he is a good team player",2021-04-06 13:28:56.557281+00:00
556,ES2007c,949.64,A,"And you know, yeah, you can fuzz it across the room and throw it at throw it at your children yeah.",POSITIVE,2,Being positive,"The speaker is making a joke, lightening the mood of the meeting overall.",2021-04-06 13:29:15.690913+00:00
556,ES2007c,1040.88,C,It's it's pointless.,NEGATIVE,5,Causing annoyance,"The speaker is calling a feature pointless, which makes him sound unenthused and that he is giving up on the idea.",2021-04-06 13:30:04.099353+00:00
1183,ES2007c,949.64,A,"And you know, yeah, you can fuzz it across the room and throw it at throw it at your children yeah.",NEGATIVE,6,He mentions throwing something at children. That is inappropriate. We should not allow comments on violence towards children to be funny.,If others read this comment they may think that it is a good idea to throw something at their children possibly harming them or killing them. Violence towards children should not be tolerated,2021-04-06 14:08:01.369337+00:00
1183,ES2007c,900.32,A,So that's another marketing point that we can use.,POSITIVE,1,Being positive,This person is really positive and it is good that she is encouraging the team letting know what options are available,2021-04-06 14:09:23.865028+00:00
1183,ES2007c,1040.88,C,It's it's pointless.,NEGATIVE,5,Dismissing others,this person  thinks that it is okay to be mean about a persons idea. This person should watch their words as to not hurt someone's feelings.,2021-04-06 14:14:23.909389+00:00
1183,ES2007c,1101.7,C,"But you know we can we can discuss this, but it sounded like from our last meeting we really wanted something that was general, but done well.",POSITIVE,6,Being agreeable,I like how this person says we and includes everyone in the comment. He does not exclude anyone. That is the attitude of a good team player.,2021-04-06 14:15:25.960143+00:00
1183,ES2007c,1148.4,A,Do we have an uh example of a good one?,NEGATIVE,6,Causing annoyance,"This guy thinks he is being smart by asking ""Do we have any good ones?"" he makes it seem that what he is looking at is really bad and with that comment, it might cause embarrassment for whoever is behind the idea.",2021-04-06 14:16:57.619224+00:00
762,ES2007c,959.41,A,Let's um let's let's hear from you about the um it's the interface.,POSITIVE,5,Asking for an opinion,This person is asking Gabriel to share what she thinks.,2021-04-06 15:06:04.334225+00:00
762,ES2007c,881.38,A,Yeah.,POSITIVE,2,Being agreeable,This person is agreeing with the idea of having rubber keys.,2021-04-06 15:08:46.290236+00:00
762,ES2007c,899.04,D,Yeah.,POSITIVE,1,Being agreeable,This person is agreeing with the points that A talked about.,2021-04-06 15:11:09.559587+00:00
1177,ES2007c,873.42,B,"Okay, so then if we use double curved case, then we have to u choose rubber push-buttons, and that's fine?",NEGATIVE,1,Being passive-aggressive,"To me, it sounds like the person is being passive aggressive. he could have worded this differently",2021-04-06 15:23:28.320679+00:00
1177,ES2007c,881.38,A,Yeah.,POSITIVE,2,Being agreeable,This person is agreeing with the person above him in selecting the rubber keys.,2021-04-06 15:24:13.992826+00:00
1177,ES2007c,880.23,C,"So rubber rubber keys, yeah.",POSITIVE,1,Being agreeable,C is agreeing with A about the simple buttons. Rubber keys is the simple buttons he is talking about.,2021-04-06 15:26:47.791533+00:00
1177,ES2007c,928.55,A,It's not actually what you are doing.,NEGATIVE,1,Dismissing others,dismissing the comment of B by saying it is not actually what he is doing.,2021-04-06 15:29:50.081184+00:00
1177,ES2007c,941.06,D,"Yeah, the rubber's good.",POSITIVE,5,Being agreeable,D agreed with A on the rubber being used and saying that it is good.,2021-04-06 15:31:01.184754+00:00
1177,ES2007c,942.05,C,"We're giving them a way to burn off steam, basically, yeah.",POSITIVE,2,Being agreeable,C also agreed with A. he agreed and backed it up by saying giving them a way to burn off steam,2021-04-06 15:32:15.349911+00:00
1177,ES2007c,949.64,A,"And you know, yeah, you can fuzz it across the room and throw it at throw it at your children yeah.",NEGATIVE,6,Being sarcastic,A said you can throw it at your children. That is definitely being sarcastic and kind of cruel even if playing,2021-04-06 15:33:23.024994+00:00
1177,ES2007c,959.41,A,Let's um let's let's hear from you about the um it's the interface.,POSITIVE,5,Being respectful,A is being inclusive and is giving another person the chance to speak on what is on their mind.,2021-04-06 15:36:50.291546+00:00
1216,ES2007c,882.2,A,"And it's cheapest all round, it sounds kinda funky, and we can also market it as i 'cause we were s saying earl you were saying earlier in your research that um the the people have the R_ people were getting the complaining about R_S_I_, and this is anti-R_S_I_.",NEGATIVE,1,It is a bit incoherent.  Hard to understand.  I think it would waste peoples time and cause confusion,Like i said above it is a bit confusing and hard to understand.  Please don't ramble and try to make sense when you speak,2021-04-06 16:21:28.477195+00:00
1216,ES2007c,969.67,A,Great.,POSITIVE,4,Being positive,Way to be positive and pipe up when someone has feedback that is contributing to the team i a possitive way,2021-04-06 16:23:24.525504+00:00
1216,ES2007c,1034.65,C,So I already mentioned the speech recognition interface.,NEGATIVE,1,Causing embarrassment,You don;t need to point that out to someone else and make them feel bad,2021-04-06 16:24:06.994507+00:00
1216,ES2007c,1155.55,A,Brilliant.,POSITIVE,6,Being positive,I like the positive feedback to this idea.  Way to compliant someones good thinking,2021-04-06 16:25:51.532966+00:00
1216,ES2007c,1265.92,C,"Yeah, I would say mayb maybe a couple of colours like uh like a black with with yellow and somewhere, like maybe the R_R_ can be yellow, or something like that.",POSITIVE,1,Being respectful,I reallylike how you presented this idea.  It didn't ridcule anybody or you didn't make it sound like you  had a superior idea.,2021-04-06 16:27:18.554935+00:00
823,ES2007c,874.48,C,<sound: laugh>,NEGATIVE,1,Causing annoyance,"Laughing in this context will annoy other participants because there is no humor here. It will make them feel insecure or confused, which may make them less likely to speak their mind. It may also prevent others from doing the same.",2021-04-06 18:54:48.466527+00:00
823,ES2007c,941.06,D,"Yeah, the rubber's good.",POSITIVE,5,Being positive,This positive feedback is rewarding another user for a good idea and/or explanation. It will encourage others to be forthcoming because the feedback will follow.,2021-04-06 18:57:12.563931+00:00
823,ES2007c,942.05,C,"We're giving them a way to burn off steam, basically, yeah.",POSITIVE,2,Being agreeable,This sort of agreeableness is great. You are demonstrating that you understand what they are saying and approve of their idea. This signals to others that you are attentive and it would be worth their while to speak their minds.,2021-04-06 18:58:00.058977+00:00
823,ES2007c,1148.4,A,Do we have an uh example of a good one?,NEGATIVE,6,Being sarcastic,These sorts of comments can put others on edge and make them less likely to share something they are on the fence about to avoid embarrassment.,2021-04-06 18:59:29.867350+00:00
823,ES2007c,949.64,A,"And you know, yeah, you can fuzz it across the room and throw it at throw it at your children yeah.",POSITIVE,2,Being humorous,"Humor is a good way to reduce stress and tension in the room, which may make others more comfortable to speak what's on their mind.",2021-04-06 19:00:52.152014+00:00
571,ES2007c,871.99,A,"The double whopper, please.",NEGATIVE,3,Causing annoyance,They are cracking a joke while people are trying to brainstorm ideas.,2021-04-06 19:37:55.131734+00:00
571,ES2007c,917.75,A,"You see, you can still get it does you still get repetitive strain injury, whether you are pressing a button or pressing a flat bit of screen.",NEGATIVE,1,Being passive-aggressive,They have a passive agressive tone and it feels like they are talking down to the other people.,2021-04-06 19:38:32.519126+00:00
571,ES2007c,1037.66,C,"I guess, we we basically vetoed that idea.",NEGATIVE,5,Punishing others,They seem to be angry that their idea was turned down by the group.,2021-04-06 19:39:38.815964+00:00
571,ES2007c,1519.19,A,"No, that would be your telephone",NEGATIVE,3,Dismissing others,They were very dismissive of the other person's idea for no reason.,2021-04-06 19:41:43.396788+00:00
571,ES2007c,1820.77,A,"Like the volume buttons should be the all the same colour and the d and the the channel buttons should be one colour and stuff like that, do you mean?",POSITIVE,2,Being respectful,They are trying to assist them in expressing their idea more clearly.,2021-04-06 19:44:58.635903+00:00
429,ES2007c,959.41,A,Let's um let's let's hear from you about the um it's the interface.,POSITIVE,5,Being respectful,"Inviting contribution from a team member, acknowledging his contributions to the task.",2021-04-06 22:44:36.939391+00:00
429,ES2007c,965.38,C,"Yeah, some of what I have to say ties into what Catherine was just talking about.",POSITIVE,2,Being respectful,Acknowledging how a team member previously contributed to the task - tying it together.,2021-04-06 22:45:33.541845+00:00
429,ES2007c,969.67,A,Great.,POSITIVE,4,Being positive,Being a cheerleader for the team members - acknowledging their contributions - appreciating them.,2021-04-06 22:46:39.276370+00:00
429,ES2007c,1004.34,C,"Uh I also took uh Reissa's marketing findings from the last meeting into consideration um, 'cause I think that's that's crucial as far as uh what keys we're going to inc inclu what buttons we are going to include and and how they're laid out.",POSITIVE,2,Being respectful,Showing appreciation for work of other unsung team members publically.,2021-04-06 22:47:36.743211+00:00
429,ES2007c,1192.2,A,Well let's um so w what are our definite decisions on this then as a team?,POSITIVE,7,Being respectful,Acknowledging all team members are stakeholders and have a say in determination of a decision,2021-04-06 22:49:23.333535+00:00
1248,ES2007c,1037.66,C,"I guess, we we basically vetoed that idea.",POSITIVE,1,Being agreeable,this shows that everyone was in agreement that it was not the right choice for the group,2021-04-07 12:44:55.207255+00:00
1248,ES2007c,1064.57,C,Um so we've already addressed that and I think that would actually be worse for something like R_S_I_ I mean you got that thumb movement that you're constantly doing.,NEGATIVE,3,Causing embarrassment,you caused the mentioned member embarrassment by bringing her into focus.,2021-04-07 12:45:53.886935+00:00
1248,ES2007c,1101.7,C,"But you know we can we can discuss this, but it sounded like from our last meeting we really wanted something that was general, but done well.",POSITIVE,6,Being respectful,you call attention to the fact that everyone has the same goals,2021-04-07 12:47:09.631407+00:00
1248,ES2007c,1192.2,A,Well let's um so w what are our definite decisions on this then as a team?,POSITIVE,7,Being positive,you are promoting teamwork for the group.  It will allow you to make progress.,2021-04-07 12:49:23.157485+00:00
1248,ES2007c,1377.85,D,Exactly.,POSITIVE,10,Being positive,you showed agreement with the speaker and acknowledged their correctness.,2021-04-07 12:52:08.497358+00:00
514,ES2007c,1037.66,C,"I guess, we we basically vetoed that idea.",NEGATIVE,5,Dismissing others,Dismisses the idea by saying it was vetoed puts it down completely.,2021-04-07 13:00:41.012203+00:00
514,ES2007c,1064.57,C,Um so we've already addressed that and I think that would actually be worse for something like R_S_I_ I mean you got that thumb movement that you're constantly doing.,NEGATIVE,3,Causing annoyance,Making the other person annoyed by pointing out that what they said was already discussed.,2021-04-07 13:01:20.386597+00:00
514,ES2007c,1101.7,C,"But you know we can we can discuss this, but it sounded like from our last meeting we really wanted something that was general, but done well.",POSITIVE,6,Being agreeable,This statement is clearly trying to bring everyone into the discussion and focusing on one central idea,2021-04-07 13:02:15.744524+00:00
514,ES2007c,1155.55,A,Brilliant.,POSITIVE,6,Being positive,Using positivity allows others to feel welcome and supported in the group.,2021-04-07 13:02:51.658188+00:00
514,ES2007c,1333.92,D,"Well, I'm just basically letting you know what's happening in the markets",NEGATIVE,1,Being passive-aggressive,This person seems to be trying to express the fact that they are getting irritated,2021-04-07 13:04:41.421256+00:00
1251,ES2007c,1037.66,C,"I guess, we we basically vetoed that idea.",NEGATIVE,5,Being sarcastic,the user sounds sarcastic in the point they didn't care for his idea,2021-04-07 13:10:42.513585+00:00
1251,ES2007c,1101.7,C,"But you know we can we can discuss this, but it sounded like from our last meeting we really wanted something that was general, but done well.",POSITIVE,6,Being agreeable,this user is considering what the others have thought of as well which is good for the rest to feel involved,2021-04-07 13:12:18.663746+00:00
1251,ES2007c,1192.2,A,Well let's um so w what are our definite decisions on this then as a team?,POSITIVE,7,Being positive,is considering the whole teams choice not just there own best interest,2021-04-07 13:13:47.751968+00:00
1251,ES2007c,1347.83,D,"<sound: other>, so from looking at this year's trends and fashions and also recent investigation that we've done in the remote control market, we have found that for the remote control market",POSITIVE,1,Being agreeable,this user contributing useful info to group and being involved,2021-04-07 13:15:59.346223+00:00
1251,ES2007c,1584.29,A,And and this is all tying in very nicely.,POSITIVE,5,Being positive,this user is giving positive feedback to other users in the group this will help them feel confident in there ideas,2021-04-07 13:19:01.103386+00:00
897,ES2007c,1257.11,C,"Um it seems like we wouldn't wanna make it too busy and too sort of gaudy, but um",NEGATIVE,3,Dismissing others,C is being very dismissive of A's idea of having colorful buttons on remote,2021-04-07 16:04:12.762052+00:00
897,ES2007c,1404.84,A,"Okay, now the trouble is is we've already decided that we're going with the stuff that works already, that's cheap.",NEGATIVE,5,Being passive-aggressive,A is stating that all the ideas so far have been very cheap and not worth much,2021-04-07 16:05:19.390801+00:00
897,ES2007c,1418.95,C,If that's what people want then we maybe we're going in the wrong direction.,NEGATIVE,2,Dismissing others,C is stating that the group has been headed in the wrong direction for ideas,2021-04-07 16:05:52.364677+00:00
897,ES2007c,1491.73,D,"looking at something that's going to be bought by people, you have to make it new, you have to make it state of the art.",NEGATIVE,1,Causing frusturation,"D is disagreeing with what his partners are saying, and that they are not being innovative enough",2021-04-07 16:07:07.895525+00:00
897,ES2007c,1534.03,B,I was just trying to find an advantage.,NEGATIVE,1,Causing embarrassment,B is trying to suggest bluetooth as an option but nobody is listening,2021-04-07 16:07:58.668354+00:00
897,ES2007c,1537.51,A,An and there is no there is no such thing.,NEGATIVE,1,Dismissing others,"A is dismissing B's idea of bluetooth completely, saying there is no such thing",2021-04-07 16:08:25.663662+00:00
897,ES2007c,1607.17,A,"Yeah, that's a great idea.",POSITIVE,12,Being positive,A is saying they have a great idea for the remote control,2021-04-07 16:08:59.799474+00:00
897,ES2007c,1843.84,C,"The one thing I'm wondering about, I hope that we're not going like too much down a gimmicky road of of having I mean if somebody go goes into the store they're gonna see like three or four normal remotes, and then a big spongy pink t tomato uh remote.",NEGATIVE,8,Dismissing others,"C is being dismissive of the fruit remote control discussion, saying its gimmicky",2021-04-07 16:10:34.241882+00:00
1281,ES2007c,1101.7,C,"But you know we can we can discuss this, but it sounded like from our last meeting we really wanted something that was general, but done well.",POSITIVE,6,Being positive,Being nice and not being rude. giving general positive commentary here.,2021-04-07 16:12:13.809323+00:00
1281,ES2007c,1093.64,C,"<gap>, or uh something for the elderly, where the remote's very large and the buttons are very large and there's only a few buttons.",POSITIVE,1,Being respectful,Being nice about a fact and reinforcing a good idea.,2021-04-07 16:12:37.456666+00:00
1281,ES2007c,1072.28,D,That does get annoying.,POSITIVE,5,Somewhat negative but not demeaning,They are disagreeing about something but not doing it in a bad way,2021-04-07 16:13:20.711379+00:00
1281,ES2007c,1108.27,C,Uh,POSITIVE,1,Being agreeable,Very neutral not saying anything bad here so not harmful,2021-04-07 16:13:47.128631+00:00
1281,ES2007c,1157.63,C,And for something for kids.,POSITIVE,1,Being positive,saying nicely that something is for kids not a bad thing to say,2021-04-07 16:14:18.429051+00:00
273,ES2007c,1072.28,D,That does get annoying.,POSITIVE,5,Being agreeable,Agreeing with C shows them that you are on board with their idea and it makes them more likely to contribute. A person that knows the group agrees with them is likely to add more input or suggestions to the project seeking more  agreement.,2021-04-07 16:28:28.247140+00:00
273,ES2007c,1155.55,A,Brilliant.,POSITIVE,6,Being positive,"Saying that it is ""brilliant"" makes people want to seek that kind of feedback as well and they will want to submit their ideas and comments as well, you may even get some agreement from the group because they liked it as well.",2021-04-07 16:30:48.016812+00:00
273,ES2007c,1192.2,A,Well let's um so w what are our definite decisions on this then as a team?,POSITIVE,7,Being respectful,Asking  for the team to come up with the results is great because it makes them feel like their opinions are valued and expected. This sort of thing makes people willing to give good input if they know you are actively looking for it from them.,2021-04-07 16:32:04.272576+00:00
273,ES2007c,1258.46,D,Maybe we can,POSITIVE,1,Being positive,Saying that there is the possibility of implementing an idea is good because it can harbor hope from the group that an idea is not doomed. They may even get to where they try to come up with ways to improve upon the original suggestion to where it may be implemented.,2021-04-07 16:33:41.504932+00:00
273,ES2007c,1315.86,A,Cool.,POSITIVE,3,Being positive,This shows that you are enjoying the ideas brought forth by the group. This should help ease them into giving even more suggestions.,2021-04-07 16:34:33.443873+00:00
273,ES2007c,1040.88,C,It's it's pointless.,NEGATIVE,5,Dismissing others,"Saying  this ideais pointless may make others not want to share an idea and have it deemed pointless. Just state that it was not feasible or not really something that could be incorporated do to cost restraints, don't just shrug it off as pointless.",2021-04-07 16:37:27.255430+00:00
1299,ES2007c,1037.66,C,"I guess, we we basically vetoed that idea.",NEGATIVE,5,Dismissing others,"Saying an idea has been vetoed sounds like it was judged as a ""bad idea"" and unilaterally dissmissed.",2021-04-07 18:46:56.998032+00:00
1299,ES2007c,1046.15,C,It would just be probably the most expensive part of our remote without any actual interesting functionality as far as operating the T_V_.,NEGATIVE,1,Causing embarrassment,Judging something as expensive and unworthy of consideration before understanding why it was suggested may make others less likely to share ideas that may be judged in such a way.,2021-04-07 18:49:05.641183+00:00
1299,ES2007c,1072.28,D,That does get annoying.,NEGATIVE,1,Causing embarrassment,"Either a person or function has been judged as ""annoying"" this shuts down other's willingness to share for fear of being judged",2021-04-07 18:50:22.175815+00:00
1299,ES2007c,1093.64,C,"<gap>, or uh something for the elderly, where the remote's very large and the buttons are very large and there's only a few buttons.",NEGATIVE,2,Dismissing others,Dismisses elderly as incompetent or incapable.  May make older members of the team feel bad for being older.,2021-04-07 18:51:55.679507+00:00
1299,ES2007c,1101.7,C,"But you know we can we can discuss this, but it sounded like from our last meeting we really wanted something that was general, but done well.",POSITIVE,6,Being respectful,Mentions the team member wanted something done well and recalled a previous meeting.  This lets the member know they are listened to and valued as a teammate.,2021-04-07 18:53:41.674724+00:00
